제목,본문,URL,날짜,요약
文정부 태양광 비리에...尹 “당시 의사 결정라인 철저 조사하라”,"윤석열 대통령이 지난 13일 용산 대통령실 청사에서 열린 제24회 국무회의에서 모두발언을 하고 있다. /대통령실
윤석열 대통령은 14일 감사원의 태양광 비리 감사 결과와 관련해 대통령실 공직기강비서관실에 “당시 태양광 사업 의사결정 라인 전반에 대해 철저히 조사하라”고 지시했다고 이도운 대변인이 브리핑을 통해 전했다.
대통령실 관계자는 ‘전임 정부의 의사결정 라인을 공직기강비서관실에서 감찰이 가능한가’라는 질문에 “전임 정부의 라인을 들여다보는 게 아니라 태양광 비리와 관련된 라인을 전반적으로 들여다보겠다는 것”이라고 답했다.
이 관계자는 “감사원에서 감사했지만, 미처 못한 부분을 공직 감찰 차원에서 하라는 것”이라며 “감찰 결과에 따라서 해당자에 대한 징계를 요구할 수도 있고 법 위반이 명백하면 수사로 이어질 수도 있다”고 했다.
그러면서 “중대 비리와 관련해선 감사나 수사로 밝혀낼 수 있는 부분이 있고, 감찰이 필요한 부분이 있는데 (이번 지시는) 감찰과 관련한 부분”이라며 “물론 그 부분이 또 다른 수사나 또 다른 감사로 연결될 수 있을 것”이라고 했다.
감사원이 전날 발표한 ‘신재생 에너지 사업 추진 실태’ 감사에서 한국전력 등 8개 공공기관 소속 임직원 250여 명이 문재인 정부 당시 본인이나 가족 명의로 태양광 사업을 해온 것으로 적발됐다.
문재인 정부의 탈원전 및 신재생에너지 확대 정책에 편승해 공공기관 임직원이나 공무원 등이 저지른 비위 혐의가 확인된 것이다.
관련 기사
태양광 업체 청탁 들어준 산업부 과장, 그 회사 대표 됐다
제2 LH… 태양광 공무원이 태양광 장사
文정부 때 ‘그린 뉴딜’ 스마트계량기 사업도 500억대 비리 드러나",https://www.chosun.com/politics/politics_general/2023/06/14/O3XQFQYVKFAS5N6GZ45YCYROJY/,2023-06-14,윤석열 대통령은 감사원의 태양광 비리 감사 결과를 받아들여 대통령실에 해당 사업 의사결정 라인을 철저히 조사하라고 지시했다. 관련자는 공직기강비서관실이 태양광 비리와 관련된 라인을 감찰하고 결과에 따라 징계나 수사 요구할 수 있다고 밝혔다. 이번 조사는 중대 비리와 관련된 부분을 감찰하고 추가적인 수사나 감사로 확장될 수 있다. 감사원 감사 결과에 따르면 한국전력 등 8개 공공기관 소속 임직원 250여 명이 문재인 정부 시절 태양광 사업 비리를 저질렀다.
"영진전문대학교, 청년 취업·고용정책 페어 개최...취업 준비 강화에 앞장","영진전문대 대학일자리플러스센터가 17일 개최한‘2025 청년 취업·고용정책 페어(Fair)’ 모습 (사진제공=영잔전문대학교) (대구=국제뉴스) 백운용 기자 = 최재영 영진전문대학교 총장은 ""청년들의 진로 설정과 취업 준비를 돕는 것은 대학의 중요한 역할”이라며 “고용정책과의 연계를 강화하고 다양한 맞춤형 프로그램을 통해 학생과 지역 청년들의 실질적인 취업 역량을 증대시키기 위해 본교 대학일자리플러스센터가 17일 교내 창조관 1층 커리어라운지에서 ‘2025 청년 취업·고용정책 페어(Fair)’를 개최했다.""고 말했다. 영진전문대학교에 따르면, ""이번 행사는 영진전문대 재학생과 졸업생, 지역 청년 등 1,000여 명이 참여한 가운데, 진로설계와 취업역량 강화를 위한 다양한 체험형 프로그램과 청년고용정책 정보 제공 부스로 운영됐다.""고 전했다. 또 영진전문대학교는 ""참가자들은 MBTI 성격유형검사를 통해 자신의 성향을 파악하고, 가치관 카드를 활용한 직업 매칭 프로그램을 통해 개인에 맞는 진로를 탐색했다. 또한, 심리검사 및 간이상담을 통한 스트레스 자가 진단, 퍼스널컬러 진단을 활용한 셀프 브랜딩, 입사 서류 및 면접 컨설팅까지 다양한 맞춤형 취업 지원 서비스를 제공받았다.""고 밝혔다. 또한, 영진전문대학교는 ""특히, 이번 행사에 대학일자리플러스센터뿐만 아니라 대구고용복지+센터와 국민취업지원제도 운영 기관(일로이룸, 지에스씨넷, 커리어스타) 등 외부 유관기관이 함께 참여해, 국민취업지원제도와 일경험지원사업, 청년도전지원사업 등 정부 고용정책 정보를 제공함으로써 청년들이 정책 활용 능력을 높이고 진로 설정에 실질적인 도움을 받을 수 있도록 지원했다.""고 덧붙였다. 나아가 영진전문대학교는 ""행사 현장에 청년들의 흥미를 더하기 위해 푸드트럭(츄러스), 룰렛 이벤트, 솜사탕, 슬러시, 팝콘 등 다양한 먹거리와 즐길 거리도 마련돼 큰 호응을 얻었다.""고 강조했다. 민영뉴스통신사 국제뉴스/paekting@naver.com",https://www.gukjenews.com/news/articleView.html?idxno=3253963,2025-04-18,"영진전문대 대학일자리플러스센터가 '2025 청년 취업·고용정책 페어'를 개최했다. 이 행사에는 1,000여 명이 참여하여 MBTI 성격유형검사, 가치관 카드를 활용한 직업 매칭 프로그램 등을 통해 진로설계와 취업역량을 강화했다. 또한, 대구고용복지+센터와 국민취업지원제도 운영 기관 등 외부 기관도 참여하여 정부 고용정책 정보를 제공했고, 푸드트럭과 다양한 이벤트로 행사 분위기를 띄웠다."
"영진전문대 대학일자리플러스센터, 2025 청년 취업·고용정책 페어 ‘성료’","[헤럴드경제(대구)=김병진 기자]영진전문대 대학일자리플러스센터는 지난 17일 교내 창조관 1층 커리어라운지에서 ‘2025 청년 취업·고용정책 페어(Fair)’를 개최했다. 이번 행사는 영진전문대 재학생과 졸업생, 지역 청년 등 1000여 명이 참여한 가운데 진로설계와 취업역량 강화를 위한 다양한 체험형 프로그램과 청년고용정책 정보 제공 부스로 운영됐다. 행사 현장에는 청년들의 흥미를 더하기 위해 푸드트럭(츄러스), 룰렛 이벤트, 솜사탕, 슬러시, 팝콘 등 다양한 먹거리와 즐길 거리도 마련돼 큰 호응을 얻었다. 박효진 대학일자리플러스센터장은 “청년들의 진로 설정과 취업 준비를 돕는 것은 대학의 중요한 역할”이라며 “앞으로도 고용정책과의 연계를 강화하고 다양한 맞춤형 프로그램을 통해 학생과 지역 청년들의 실질적인 취업 역량 향상에 기여하겠다”고 말했다. kbj7653@heraldcorp.com",https://biz.heraldcorp.com/article/10468589,2025-04-18,"영진전문대 대학일자리플러스센터가 '2025 청년 취업·고용정책 페어'를 개최했다. 1000여 명이 참여한 이번 행사는 진로설계와 취업역량 강화를 위한 다양한 프로그램과 청년고용정책 정보 제공 부스로 운영됐다. 행사에는 푸드트럭, 룰렛 이벤트, 솜사탕, 슬러시, 팝콘 등 다양한 먹거리와 즐길 거리가 마련돼 청년들로부터 큰 호응을 얻었다. 대학일자리플러스센터장은 앞으로도 학생과 지역 청년들의 취업 역량 향상을 위해 고용정책과의 연계를 강화할 계획이라고 밝혔다."
"영진전문대, ‘2025 청년 취업·고용정책 페어’ 성황리 개최","영진전문대 대학일자리플러스센터가 지난 17일 ‘2025 청년 취업·고용정책 페어(Fair)’를 개최했다. [사진출처=영진전문대] [오늘경제 = 김성희 기자] 영진전문대(총장 최재영) 대학일자리플러스센터는 지난 17일 교내 창조관 1층 커리어라운지에서 ‘2025 청년 취업·고용정책 페어(Fair)’를 성황리에 개최했다고 18일 밝혔다. 이번 행사는 영진전문대 재학생과 졸업생, 지역 청년 등 1000여 명이 참여한 가운데 청년들의 진로 탐색과 취업역량 강화를 지원하기 위해 다양한 체험형 프로그램과 고용정책 정보를 제공하는 부스를 운영하며 큰 호응을 얻었다. 참가자들은 MBTI 성격유형 검사와 가치관 카드 활용 직업 매칭 프로그램을 통해 자신의 성향과 적성에 맞는 진로를 탐색했고 심리검사 및 간이 상담을 통해 스트레스 상태를 자가 진단하는 시간도 가졌다. 이 외에도 퍼스널컬러 진단을 활용한 셀프 브랜딩, 입사 서류 작성법과 모의 면접 컨설팅 등 실질적인 취업 지원 프로그램도 마련돼 많은 관심을 끌었다. 특히 이번 행사에는 대학일자리플러스센터뿐만 아니라 대구고용복지+센터, 국민취업지원제도 운영기관 등 외부 유관기관도 함께 참여해 국민취업지원제도, 청년도전지원사업, 일경험지원사업 등 정부의 다양한 고용 정책 정보를 제공했다. 이를 통해 청년들이 자신에게 필요한 정책을 제대로 이해하고 활용할 수 있도록 실질적인 도움을 줬다. 행사장 한편에는 츄러스 푸드트럭과 솜사탕, 슬러시, 팝콘 등의 먹거리와 룰렛 이벤트 등 청년들이 즐길 수 있는 프로그램도 함께 마련되어 더욱 활기찬 분위기 속에서 진행됐다. 박효진 대학일자리플러스센터장은 “청년들의 진로 설정과 취업 준비는 대학이 감당해야 할 중요한 책무”라며 “앞으로도 지역과 연계한 고용정책 기반의 실효성 높은 프로그램을 통해 청년들의 취업역량 향상에 적극적으로 기여하겠다”고 말했다. 한편 영진전문대는 대학일자리플러스센터를 통해 재학생은 물론 졸업생과 지역 청년을 대상으로 전문 컨설턴트 상담, 프로그램 운영, 채용 정보 제공 등 전 주기적인 진로·취업 지원 서비스를 제공하고 있다.",https://www.startuptoday.co.kr/news/articleView.html?idxno=436930,2025-04-18,"영진전문대 대학일자리플러스센터가 '2025 청년 취업·고용정책 페어'를 개최했다. 이번 행사에는 1000여 명이 참여해 MBTI 성격유형 검사, 가치관 카드 활용 직업 매칭 프로그램 등을 통해 진로 탐색과 취업역량 강화를 지원했다. 또한 대구고용복지+센터, 국민취업지원제도 등 외부 기관도 참여해 정부의 고용 정책 정보를 제공했고, 츄러스 푸드트럭과 먹거리, 룰렛 이벤트 등 다양한 프로그램을 통해 청년들을 지원했다."
영진전문대 대학일자리플러스센터 ‘청년 취업·고용정책 페어’ 개최,"영진전문대가 지난 17일 ‘2025 청년 취업·고용정책 페어’를 진행하고 있다. 영진전문대 대학일자리플러스센터는 지난 17일 교내 창조관에서 ‘2025 청년 취업·고용정책 페어’를 개최했다. 이번 행사는 영진전문대 재학생과 졸업생, 지역 청년 등 1천여 명이 참여한 가운데, 진로설계와 취업역량 강화를 위한 다양한 체험형 프로그램과 청년고용정책에 대한 정보를 제공하는 방식으로 운영됐다. 참가자들은 MBTI 성격유형검사를 통해 자신의 성향을 파악하고, 가치관 카드를 활용한 직업 매칭 프로그램을 통해 개인에 맞는 진로를 탐색했다. 또 심리검사 및 간이상담을 통한 스트레스 자가 진단, 퍼스널컬러 진단을 활용한 셀프 브랜딩, 입사 서류 및 면접 컨설팅까지 다양한 맞춤형 취업 지원 서비스를 제공받았다. 특히 이번 행사에는 대학일자리플러스센터뿐만 아니라 대구고용복지+센터와 국민취업지원제도 운영 기관(일로이룸, 지에스씨넷, 커리어스타) 등 외부 유관기관이 함께 참여해 국민취업지원제도와 일경험지원사업, 청년도전지원사업 등 정부 고용정책 정보를 제공했다. 이날 행사 현장에는 청년들의 흥미를 더하기 위해 푸드트럭, 룰렛 이벤트 다양한 먹거리와 즐길 거리도 마련됐다. 박효진 영진전문대 대학일자리플러스센터장은 “청년들의 진로 설정과 취업 준비를 돕는 것은 대학의 중요한 역할”이라며 “앞으로도 고용정책과의 연계를 강화하고 다양한 맞춤형 프로그램을 통해 학생과 지역 청년들의 실질적인 취업 역량 향상에 기여하겠다”고 밝혔다. 김명규 기자",https://www.idaegu.com/news/articleView.html?idxno=635087,2025-04-18,"영진전문대가 '2025 청년 취업·고용정책 페어'를 개최했다. 이번 행사에는 1천여 명의 재학생, 졸업생, 지역 청년이 참여했으며 MBTI 성격유형검사와 직업 매칭 프로그램 등을 통해 진로설계와 취업역량을 강화했다. 또한, 심리검사, 스트레스 자가 진단, 퍼스널컬러 진단, 면접 컨설팅 등 다양한 취업 지원 서비스를 제공했고, 외부 유관기관도 참여하여 정부 고용정책 정보를 제공했다. 행사장에는 푸드트럭과 룰렛 이벤트 등 다양한 먹거리와 즐길 거리도 마련돼 청년들의 흥미를 끌었다."
"영진전문대 대학일자리플러스센터, 17일 '2025 청년 취업·고용정책 페어(Fair)' 성료","영진전문대학교(총장 최재영) 대학일자리플러스센터는 17일 교내 창조관 1층 커리어라운지에서 '2025 청년 취업·고용정책 페어(Fair)'를 성황리에 개최했다. 이번 행사는 영진전문대 재학생과 졸업생, 지역 청년 등 1000여 명이 참여했다. 진로설계와 취업역량 강화를 위한 다양한 체험형 프로그램과 청년고용정책 정보 제공 부스로 운영됐다. 참가자들은 MBTI 성격유형검사를 통해 자신의 성향을 파악하고, 가치관 카드를 활용한 직업 매칭 프로그램을 통해 개인에 맞는 진로를 탐색했다. 또 심리검사 및 간이상담을 통한 스트레스 자가 진단, 퍼스널컬러 진단을 활용한 셀프 브랜딩, 입사 서류 및 면접 컨설팅까지 다양한 맞춤형 취업 지원 서비스를 제공받았다. 특히 이번 행사에는 대학일자리플러스센터뿐만 아니라 대구고용복지+센터와 국민취업지원제도 운영 기관(일로이룸, 지에스씨넷, 커리어스타) 등 외부 유관기관이 함께 참여해, 국민취업지원제도와 일경험지원사업, 청년도전지원사업 등 정부 고용정책 정보를 제공했다. 청년들이 정책 활용 능력을 높이고 진로 설정에 실질적인 도움을 받을 수 있도록 지원했다. 행사 현장에는 청년들의 흥미를 더하기 위해 푸드트럭(츄러스), 룰렛 이벤트, 솜사탕, 슬러시, 팝콘 등 다양한 먹거리와 즐길 거리도 마련돼 큰 호응을 얻었다. 박효진 영진전문대 대학일자리플러스센터장은 “청년들의 진로 설정과 취업 준비를 돕는 것은 대학의 중요한 역할”이라며 “앞으로도 고용정책과의 연계를 강화하고 다양한 맞춤형 프로그램을 통해 학생과 지역 청년들의 실질적인 취업 역량 향상에 기여하겠다”고 밝혔다. 한편, 영진전문대학교는 대학일자리플러스센터를 통해 재학생과 졸업생, 지역 청년들에게 전문 컨설턴트 상담, 프로그램 운영, 채용 정보 제공 등 전 주기적인 진로·취업 지원 서비스를 제공하고 있다. 대구=정재훈 기자 jhoon@etnews.com",https://www.etnews.com/20250417000410,2025-04-17,"영진전문대 대학일자리플러스센터가 '2025 청년 취업·고용정책 페어'를 개최했다. 이번 행사에는 1000여 명의 재학생, 졸업생, 지역 청년이 참여했고, MBTI 성격유형검사와 직업 매칭 프로그램을 통해 진로를 탐색했다. 또한 심리검사, 간이상담, 퍼스널컬러 진단 등 다양한 취업 지원 서비스를 제공했으며, 대구고용복지+센터와 국민취업지원제도 운영 기관도 참여해 고용정책 정보를 제공했다. 대학은 앞으로도 학생과 지역 청년들의 취업 역량 향상을 위해 노력할 계획이다."
"영진전문대, 대구 15개 특성화·마이스터고와 고용서비스 협력","사진은 영진전문대학교와 15개 특성화·마이스터고교가 ‘2025년 고교생 맞춤형 고용서비스’ 제공을 위한 업무협약을 체결하고 관계자들이 기념 촬영을 하고 있다. 영진전문대학교가 대구지역 15개 특성화고와 마이스터고와 함께 고등학생 맞춤형 고용서비스 제공에 나섭니다. 영진전문대학교는 최근 대학 본관 대회의실에서 ‘2025년 고교생 맞춤형 고용서비스’ 제공을 위한 업무협약을 체결했습니다. 협약식에는 영진전문대학교 최재영 총장과 대학 주요 보직자, 그리고 대구지역 15개 고등학교의 교장과 산학협력부장이 참석해 상호 협력의 뜻을 모았습니다. 이번 협약에 참여한 고등학교는 경북공업고, 경북기계공업고, 경북여자상업고, 경상공업고, 대구공업고, 대구과학기술고, 대구관광고, 대구농업마이스터고, 대구반도체마이스터고, 대구보건고, 대구여자상업고, 대구일마이스터고, 대구제일여자상업고, 대구하이텍고, 대중금속고등 등 총 15곳입니다. 이번 협약을 통해 영진전문대와 고등학교들은 진로 탐색과 경력 개발 프로그램 운영, 직업교육과 취업 정보 공유, 고교생 대상 취업역량 강화, 지역기반 고용 활성화를 위한 공동 협력에 나설 계획입니다. 최재영 총장은 ““청년 고용 플랫폼으로서의 역할을 강화하고, 지역사회와 함께 인재를 육성해 나가겠다”고 말했습니다. 영진전문대학교는 이번 협약을 계기로 맞춤형 취업 상담, 진로·취업 연계 프로그램, 직무 체험 중심의 실습 교육, 취업캠프 등 실효성 높은 다양한 고용지원 프로그램을 운영할 예정입니다.",https://news.bbsi.co.kr/news/articleView.html?idxno=4026330,2025-04-16,"영진전문대학교와 15개 특성화·마이스터고교가 2025년 고교생을 위한 맞춤형 고용서비스를 위한 업무협약을 체결했다. 이를 통해 대구지역 15개 고등학교와 함께 진로 탐색, 경력 개발 프로그램 운영, 취업 정보 공유 등을 위한 협력을 강화할 예정이다. 영진전문대학교는 이를 통해 맞춤형 취업 상담, 진로·취업 연계 프로그램, 직무 체험 중심의 실습 교육, 취업캠프 등을 운영하여 지역사회와 함께 청년 인재를 육성할 계획이다."
"영진전문대, 일본 IT기업으로부터 8년째 장학금 기탁 받아","대구 영진전문대학교가 최근 일본 IT전문기업 ISFNET 회장 일행이 교내를 방문해 장학금 2000만원을 전달했다고 17일 밝혔다. 2018년 첫 기탁 이후 올해로 8년째 이어진 이 회사의 장학금 총액은 누계 1억5000만원을 돌파했다. 지난 15일 열린 장학금 전달식에는 ISFNET의 와타나베 유키요시 회장을 비롯해 모또무라 부사장, 허옥인 한국법인 대표, 김성은 국제협력본부장과 함께 영진전문대학교 최재영 총장, 류용희 컴퓨터정보계열 부장 등이 참석했다.도쿄에 본사를 둔 ISFNET은 일본 전역을 대상으로 클라우드, 솔루션, IT 인프라 구축 등의 분야에서 최대 규모의 사업을 펼치고 있으며 한국을 비롯해 중국, 싱가포르, 인도 등 해외에도 지사를 두고 있는 글로벌 네트워크 전문기업이다.ISFNET은 지난 2017년 일본 현지에서 근무 중인 영진전문대 졸업생들의 우수한 역량에 주목하며 직접 대구를 방문, 컴퓨터정보계열과 ‘국제연계 주문식교육 협약’을 체결했다.이 협약을 통해 일본어 능력과 시스코 자격을 갖춘 학생에게는 취업을 보장하는 파격 조건을 제시했고 대학은 2018년 ‘일본네트워크 주문반’을 개설, 기업 맞춤형 인재 양성에 나섰다.그 결과 2019년 17명을 시작으로 지난 2월 졸업자 12명을 포함해 지금까지 총 104명이 이 회사에 취업했다.와타나베 ISFNET 회장은 이번 방문에서 글로벌네트워크반 및 협약반 2학년생을 대상으로 회사 설명회를, 내년도 졸업 예정인 협약반 3학년생들과는 간담회를 가졌다.와타나베 회장은 “영진 학생들이 회사에서 매우 성실하고 능력 있게 근무하고 있어 만족하고 있다”며 “특히 올해부터 함께하는 네팔 유학생 교육도 잘 부탁드린다”고 말했다.최재영 영진전문대 총장은 “학생들을 최선을 다해 교육해 기업과 함께 성장할 수 있는 우수 인재로 키우겠다”며 “매년 방문해 지속적인 장학금 기탁을 이어가는데 깊이 감사드린다”고 했다.&nbsp;",http://www.kbsm.net/news/view.php?idx=471907,2025-04-17,"일본 IT전문기업 ISFNET이 대구 영진전문대학교에 장학금 2000만원을 전달했다. 이로써 8년간 누적 장학금은 1억5000만원을 돌파했다. ISFNET은 한국을 비롯한 해외에도 지사를 두며, 대구 영진전문대 졸업생들에게 취업 기회를 제공하고 있다. 현재까지 104명이 이 회사에 취업했으며, 회장은 영진 학생들의 능력을 높이 평가하고 향후 협력을 강조했다."
"영진전문대, 일본 IT기업으로부터 8년째 장학금 기탁 받아","[헤럴드경제(대구)=김병진 기자]영진전문대가 일본의 유수 IT기업으로부터 8년째 장학금을 기탁받으며 글로벌 IT인재 양성에 더욱 탄력을 받고 있다. 17일 영진전문대에 따르면 지난 15일 일본 IT전문기업 ㈜ISFNET 회장 일행이 교내를 방문해 장학금 2000만원을 전달했다. 2018년 첫 기탁 이후 올해로 8년째 이어진 이 회사의 장학금 총액은 누계 1억 5000만원을 돌파했다. 이날 오후 총장실에서 열린 장학금 전달식에는 ISFNET의 와타나베 유키요시 회장을 비롯해 모또무라 부사장, 허옥인 한국법인 대표, 김성은 국제협력본부장과 함께 영진전문대 최재영 총장, 류용희 컴퓨터정보계열 부장 등이 참석했다. 도쿄에 본사를 둔 ISFNET은 일본 전역을 대상으로 클라우드, 솔루션, IT 인프라 구축 등의 분야에서 최대 규모의 사업을 펼치고 있으며 한국을 비롯해 중국, 싱가포르, 인도 등 해외에도 지사를 두고 있는 글로벌 네트워크 전문기업이다. ISFNET은 지난 2017년 일본 현지에서 근무 중인 영진전문대 졸업생들의 우수한 역량에 주목하며 직접 대구를 방문, 컴퓨터정보계열과 ‘국제연계 주문식교육 협약’을 체결했다. 이 협약을 통해 일본어 능력(JLPT 2급)과 시스코(Cisco) 자격을 갖춘 학생에게는 취업을 보장하는 파격 조건을 제시했고 대학은 2018년 ‘일본네트워크 주문반’을 개설, 기업 맞춤형 인재 양성에 나섰다. 그 결과 2019년 17명을 시작으로 2025년 2월 졸업자 12명을 포함해 지금까지 총 104명이 이 회사에 취업했다. 와타나베 회장은 이번 방문에서 글로벌네트워크반(해외 유학생) 및 협약반 2학년생을 대상으로 회사 설명회를, 내년도 졸업 예정인 협약반 3학년생들과는 간담회를 가졌다. 장학금 전달식에서 와타나베 회장은 “영진 학생들이 회사에서 매우 성실하고 능력 있게 근무하고 있어 만족하고 있다”며 “특히 올해부터 함께하는 네팔 유학생 교육도 잘 부탁드린다”고 말했다. 이에 최재영 영진전문대 총장은 “학생들을 최선을 다해 교육해 기업과 함께 성장할 수 있는 우수 인재로 키우겠다”며 “매년 방문해 지속적인 장학금 기탁을 이어가는 데 깊이 감사드린다”고 화답했다. kbj7653@heraldcorp.com",https://biz.heraldcorp.com/article/10467135,2025-04-17,"일본 IT기업 ISFNET이 영진전문대에 8년째 장학금 2000만원을 기탁해 누적 1억 5000만원을 돌파했다. ISFNET은 한국을 비롯한 해외에도 지사를 두고 있는 글로벌 네트워크 전문기업으로, 졸업생들의 우수한 역량을 인정하고 취업 기회를 제공하고 있다. 지금까지 총 104명이 이 회사에 취업했으며, 와타나베 회장은 영진 학생들의 성실함에 만족하며 앞으로도 지속적인 지원을 약속했다. 최재영 영진전문대 총장은 학생들을 기업과 함께 성장할 수 있는 우수 인재로 키우겠다고 밝혔다."
