제목,본문,URL,날짜,요약
"대통령실, 교육부 대입국장 교체에 “강력한 이권카르텔 증거”","이주호 사회부총리 겸 교육부 장관이 15일 오후 서울 용산 대통령실 청사에서 교육 개혁 추진 방안 관련 브리핑을 위해 입장하며 김은혜 홍보수석과 대화하고 있다. /연합뉴스
대통령실은 16일 교육부 대입 담당 국장을 대기발령 조치한 것과 관련, “강력한 이권 카르텔의 증거로 오늘 경질을 예의주시할 필요가 있다”고 말했다. 교육부 대입 담당 국장은 지난 1월 보임됐고, 6개월 만에 인사이동이 난 것은 이례적이다.
대통령실은 언론에 “윤석열 대통령이 (수능 출제와 관련해) 몇 달간 지시하고, 장관도 이에 따라 지시한 지침을 국장이 버티고 이행하지 않았다”며 이같이 밝혔다.
교육부는 이날 대학 입시를 담당했던 이윤홍 인재정책기획관을 대기발령 조치하고 후임으로 심민철 디지털교육기획관을 임명했다.
윤 대통령이 사교육비 증가와 대학수학능력시험 난이도 문제를 지적한 다음 날 교체가 이뤄진 것은 새 정부가 출범한 지 1년여가 지났음에도 일부 공직자들이 새 국정 기조를 이행하지 않는 데 따른 윤 대통령의 경고가 담긴 것으로 해석된다.
윤 대통령은 전날 이주호 부총리 겸 교육부 장관으로부터 보고를 받는 자리에서 “공교육 교과과정에서 다루지 않는 분야의 문제는 수능 출제에서 배제해야 한다”고 했다.
또 윤 대통령은 “과도한 배경지식을 요구하거나 대학 전공 수준의 비문학 문항 등 공교육 교과과정에서 다루지 않는 부분의 문제를 수능에서 출제하면 사교육에 의존하라는 것 아닌가”라며 “교육당국과 사교육 산업이 한 편(카르텔)이란 말인가”라고 했다.
관련 기사
尹, 올초부터 “공교육 밖에서 수능 출제 말라”…이행 안한 교육부 大入국장 경질
대통령실 “尹, 쉬운·어려운 수능 얘기한 것 아냐”
이 부총리는 이 발언과 관련해 “원론적인 말씀이지만 (그동안) 잘 지켜지지 않은 부분도 있었던 것에 대한 문제 제기라고 생각한다”며 “수능은 반드시 수업만 열심히 따라가면 풀 수 있도록 출제되도록 하겠다”고 했다.",https://www.chosun.com/politics/blue_house/2023/06/16/3RMG7KVJZZBDRPCY4IE4T43GTU/,2023-06-16,이주호 사회부총리 겸 교육부 장관이 교육 개혁을 위해 대입 담당 국장을 경질하고 새로운 인재를 임명했다. 윤 대통령은 수능 출제에서 공교육과 다른 부분은 배제해야 한다고 강조하며 사교육 의존 문제를 지적했다. 이주호 장관은 이 발언을 지켜나갈 것이라고 밝혔다.
“장경태 무릎보호대 기절쇼” 장예찬 양반다리 퍼포먼스... 이재명 “패륜적 행위”,"이재명 더불어민주당 대표가 16일 오전 서울 서초구 서울중앙지방법원에서 열린 공직선거법위반 4회 공판에 출석하고 있다. 2023.6.16/뉴스1
이재명 더불어민주당 대표가 16일 발언 도중 쓰러진 장경태 의원의 ‘무릎보호대’ 착용 의혹을 거론하며 양반다리 퍼포먼스를 벌인 장예찬 국민의힘 청년최고위원에 대해 “정말 패륜적 행위”라고 비판했다.
이 대표는 이날 오전 국회에서 열린 최고위원회의에서 “장 의원이 쓰러진 것을 두고 장예찬 청년최고위원은 ‘쇼를 한 것 아니냐’, ‘무릎 보호대를 착용하고 있었다’는 이야기까지 하는 걸 보고 도대체 이게 최소한의 인간적 도의를 갖췄느냐는 생각이 들었다”며 이같이 밝혔다.
서영교 최고위원도 이날 장 최고위원을 겨냥해 “이런 사람이 정치인 자격이 있는가”라며 “나쁜 말만 골라서 하고 이런 폐륜적인 발언을 한 장 최고위원은 국민의힘의 엄청난 리스크”라고 비판했다.
장예찬 국민의힘 최고위원은 더불어민주당 장경태 의원(오른쪽)이 지난 14일 방통위 항의방문 도중 갑자기 쓰러진 건 '연출한 기절쇼'라고 주장했다. 그 근거로 장경태 의원이 미리 무릎 보호대를 찬 듯한 흔적(오른쪽 붉은 원)을 든 장 최고는 무릎보호대를 차고도 얼마든지 양반자세를 할 수 있다며 직접 시범까지 보였다./장예찬 의원 페이스북
장예찬 국민의힘 최고위원이 지난 15일 국민의힘 최고위원회의 발언 도중 ″무릎보호대를 차고 왔다″며 자리에서 일어나 양반다리를 하고 바닥에 앉았다. 전날 방통위 항의방문 도중 쓰러진 장경태 더불어민주당 최고위원의 ‘무릎보호대 착용 의혹’을 겨냥해 퍼포먼스를 한 것이다.
국회 과학기술정보방송통신위원회 소속인 장경태 최고위원은 지난 14일 KBS 수신료 분리 징수를 위한 방송법 시행령 개정안에 반대하며 같은 당 조승래 의원과 방통위 앞에서 성명서를 읽던 중 기침을 하다 갑자기 쓰러졌다.
관련 기사
방통위 항의 방문한 장경태, 성명서 읽다 돌연 실신
실신한 장경태, 무릎보호대 착용? “절대 아냐, 법적 대응”
‘기절쇼 의혹’ 장경태에…천안함 장병 “음모론 억울함 알겠나”
일부 온라인 커뮤니티에서는 당시 장 의원 사진을 토대로 그가 무릎보호대를 착용한 채 ‘기절쇼’를 한 것이 아니냐는 의혹이 제기됐으나 장 의원은 이를 부인하며 해당 의혹을 처음 제기한 네티즌을 상대로 법적 대응을 예고했다.",https://www.chosun.com/politics/assembly/2023/06/16/TQLV5QBMTZFZLFRJRORCERXTUI/,2023-06-16,"이재명 더불어민주당 대표는 국회에서 열린 최고위원회의에서 장경태 의원의 쓰러짐을 놓고 국민의힘 최고위원인 장예찬에게 ""무릎보호대 착용 의혹을 거론해 양반다리 퍼포먼스를 한 것은 패륜적 행위""라고 비판했다. 장예찬 최고위원은 방송법 시행령 개정안 반대 성명서를 읽다가 쓰러진 장경태 의원에 대한 '기절쇼 의혹'을 제기하며 논란을 일으켰고, 장 의원은 무릎보호대 착용 의혹을 부인하며 법적 대응을 예고했다."
윤재옥 “대법원 ‘노란봉투법’ 알박기 판결...선을 넘어도 한참 넘어”,"윤재옥 국민의힘 원내대표가 16일 오전 서울 여의도 국회에서 열린 원내대책회의에서 모두발언을 하고 있다. 2023.6.16/뉴스1
국민의힘 윤재옥 원내대표는 16일 대법원의 손해배상 책임 개별 산정 판결에 대해 “김명수 대법원장은 자신을 포함한 몇몇 대법관의 교체를 앞두고 ‘노란봉투법’(노동조합 및 노동관계조정법 개정안) 알박기 판결을 한 것”이라고 비판했다.
윤 원내대표는 이날 국회에서 열린 원내대책회의에서 “선을 넘어도 한참 넘었다”며 “입법부 차원에서 심각한 유감을 표한다”고 밝혔다.
윤 원내대표는 “대법원 판결은 사실상 노조의 불법 행위에 기업의 손해배상 청구를 원천적으로 제한하는 판결”이라며 “대법원은 노란봉투법을 판례로 뒷받침하면서 국회의 쟁점 법안을 임의로 입법화하는 결과를 빚었다”고 말했다.
대법원은 전날 불법 파업에 참여한 노동자 개인에게 사측이 손해배상 책임을 물을 때 불법 행위의 정도에 따라 개별적으로 따져야 한다고 판결했다.
윤 원내대표는 “이는 법률적 판결이라기보다 정치적 판결이며, 입법과 사법의 분리라는 헌법 원리에 대한 도전이기도 하다”며 “국회에서 여야 간에 입법을 두고 극명한 입장 차이를 보이고 있다면 법원은 관련 판결을 일정 기간 유예하고 국회 논의 결과를 지켜보는 게 상식적이다. 선을 넘어도 한참 넘었다”고 했다.
윤 원내대표는 민주당이 단독 강행 처리 수순을 밟고 있는 노란봉투법과 관련, “(노사관계와 산업 현장에 대한) 악영향으로 문재인 정부도 국정과제로 선정만 해놓고 실제 추진하지는 못했다”며 “지금 민주당이 야당이 돼 노란봉투법을 강행하고자 하는 것도 노조 표를 놓고 정부·여당에 정치적 부담을 지우겠다는 계산”이라고 비판했다.
이어 “이번 사건의 주심을 맡은 노정희 대법관을 비롯해 아무리 대법원 인적 구성이 이념적으로 편향됐다고 하나, 이번에는 대법원이 법적 안정성을 훼손하면서까지 사실상 정치 행위를 한 것이기에 큰 충격을 받지 않을 수 없다”고 했다.
관련 기사
판례로 ‘노란봉투법’ 만든 대법원… 불법파업 손해배상 제약 커진다
그는 “아무리 김명수 체제가 곧 끝난다지만, 아무리 해당 사건의 주심이 ‘소쿠리 투표’ 등으로 유명한 노 대법관이라지만, 공정하고 중립적이어야 할 법원이 이렇게 편향적 판결을 내리고 법을 지키지 않아도 된다는 면죄부로 판결을 해서야 되겠나”라고 했다.
그러면서 “산업계에 악영향을 미칠 것이 분명한 만큼, 정부와 여당은 노란봉투법을 단호히 막아내겠다”고 말했다.",https://www.chosun.com/politics/politics_general/2023/06/16/GETRQF2HPNHYDGACRIPXN6J2EE/,2023-06-16,"윤재옥 국민의힘 원내대표는 대법원의 노란봉투법 판결을 비판하며, 이를 정치적 판결이라고 지적했고, 입법과 사법의 분리 원칙에 도전했다. 또한, 민주당의 노란봉투법 강행 처리를 비난하며 정치적 부담을 지우려는 의도로 해석했다. 윤 원내대표는 대법원의 이러한 판결이 산업계에 부정적인 영향을 미칠 것으로 우려하며, 정부와 여당은 노란봉투법을 막아야 한다고 강조했다."
"대통령실 “尹, 쉬운·어려운 수능 얘기한 것 아냐”","이주호 사회부총리 겸 교육부 장관이 15일 용산 대통령실 청사에서 윤석열 대통령에게 보고한 교육개혁 추진 방안과 관련한 브리핑을 하고 있다./2023.6.15/뉴스1
대통령실은 16일 “윤석열 대통령은 전날 이주호 부총리 겸 교육부 장관에게 ‘쉬운 수능’, ‘어려운 수능’을 얘기한 게 아니다”라고 밝혔다.
대통령실 김은혜 홍보수석은 이날 서면 브리핑에서 윤 대통령이 전날 이 장관에게 보고받는 자리에서 언급한 구체적 발언 내용을 소개하면서 이같이 말했다.
윤 대통령은 전날 이 장관에게 교육개혁 추진 상황을 보고받는 자리에서 “공정한 변별력은 모든 시험의 본질이므로 변별력은 갖추되 공교육 교과 과정에서 다루지 않는 분야는 수능에서 배제하라”고 말했다고 김 수석은 전했다.
윤 대통령은 또 “공교육 교과 과정에서 다루는 분야이지만, 학교 교육을 보충하기 위해 사교육을 찾는 것은 선택의 자유로서 정부가 막을 수 없다”고 언급했다.
이어 “하지만 공교육 교과과정에서 아예 다루지 않은 비문학 국어 문제라든지 학교에서 도저히 가르칠 수 없는 과목 융합형 문제 출제는 처음부터 교육당국이 사교육으로 내모는 것으로서 아주 불공정하고 부당하다”고 말했다.
윤 대통령은 “국민들은 이런 실태를 보면 교육 당국과 사교육 산업이 한통속이라고 생각하게 된다”고 밝혔다고 김 수석은 전했다.
대통령실의 이 같은 해명은 윤 대통령의 수능 출제 언급에 2024학년도 수능 난이도에 관심이 쏠리고 수험생들의 동요가 우려된다는 일각의 주장에 따른 것이다.
관련 기사
尹, 올초부터 “공교육 밖에서 수능 출제 말라”…이행 안한 교육부 大入국장 경질
尹대통령 “학교서 다루지 않은 내용, 수능 출제 배제해야”
과학 같은 국어 문제 없앤다… 수능 꼬아서 안 내기로",https://www.chosun.com/politics/blue_house/2023/06/16/WEHTCKHPANBEPEFKDGRUBCXSZM/,2023-06-16,"이주호 사회부총리 겸 교육부 장관은 윤석열 대통령에게 교육개혁 방안을 보고했으며, 윤 대통령은 ""수능에서 공교육 교과과정에서 다루지 않는 분야는 배제해야 한다""고 밝혔다. 또한, 학교 교육을 보충하기 위해 사교육을 찾는 것은 선택의 자유라며, 수능 출제가 불공정하고 부당하다고 지적했다. 윤 대통령의 발언은 2024학년도 수능 난이도와 수험생들의 동요에 대한 우려로 대통령실에서 해명되었다."
"北은 반격 훈련에 반발, 동해로 탄도미사일 2발 발사","북한 탄도미사일 . /평양 노동신문 뉴스1
북한이 15일 평양 순안 일대에서 동해상으로 단거리탄도미사일(SRBM) 2발을 발사했다고 합동참모본부가 밝혔다. 북한이 지난달 31일 탄도미사일 기반의 정찰위성 발사체를 쏜 지 보름 만이자, 지난 4월 13일 대륙간탄도미사일(ICBM) 화성-18형을 쏜 지 63일 만이다. 북한 핵·미사일 위협에 대비하기 위해 지난달 25일부터 이날까지 총 5차례에 걸쳐 실시한 한미 연합·합동 화력격멸훈련에 대한 반발로 풀이된다.
합참은 이날 “북한이 오후 7시 25분부터 오후 7시 37분까지 SRBM 2발을 발사한 것으로 포착했다”면서 “추가 도발에 대비해 감시·경계를 강화했다”고 밝혔다. 두 발은 780여km를 날아간 뒤 동해에 떨어졌다고 합참은 밝혔다. 일본 공영방송 NHK와 교도통신은 북한 미사일이 “일본의 배타적경제수역(EEZ) 안쪽에 떨어진 것으로 보인다”고 밝혔다. 북한 탄도미사일이 일본 EEZ 안쪽에 떨어진 것은 지난 2월 18일 이후 처음이다. 일본 해상보안청은 아직 선박 피해와 관련된 정보는 입수되지 않았다고 전했다.
군 관계자는 “화력격멸훈련 종료 시점을 기다렸다가 발사한 것으로 추정된다”고 말했다. 한미 연합군은 이날 윤석열 대통령, 이종섭 국방장관 등이 참관한 가운데 역대 최대 규모 훈련을 벌였다. 북한은 이날 한미 훈련 종료 직후 조선중앙통신에 국방성 대변인 명의의 ‘경고 입장’을 냈다. 북한은 이 입장문에서 화력격멸훈련을 언급하며 “지역 군사적 긴장을 더욱 야기하는 무책임한 행동을 경고한다”면서 “어떤 형태의 시위성 행동과 도발에도 철저히 대응할 것”이라고 했다.",https://www.chosun.com/politics/diplomacy-defense/2023/06/16/GXCK6J6ISRB7JBVKE4WENZK4AA/,2023-06-16,"북한은 15일 동해상으로 단거리탄도미사일 2발을 발사했으며, 이는 대륙간탄도미사일(ICBM) 화성-18형 발사 후 63일만이다. 발사된 미사일은 780km를 날아가 동해에 떨어졌는데, 이는 지난 2월 이후 처음으로 일본의 배타적경제수역(EEZ) 안쪽에 떨어진 사례다. 이는 한미 연합군의 화력격멸훈련에 대한 북한의 반발로 풀이된다.북한은 화력격멸훈련 종료 직후 국방성 대변인 명의의 ‘경고 입장’을 통해 지역 군사적 긴장을 야기하는 행동에 대해 경고하고, 어떤 도발에도 철저히 대응할 것이라고 밝혔다."
野 혁신위원장에 김은경 외대 교수,"더불어민주당이 15일 혁신기구를 맡아 당을 쇄신할 책임자로 김은경 한국외대 법학전문대학원 교수를 임명했다. 지난달 쇄신의총에서 당을 쇄신할 혁신기구를 띄우겠다고 발표한 지 약 한 달 만에서야 장(長)을 인선한 것이다.
권칠승 수석대변인은 이날 국회 소통관에서 브리핑을 갖고 “원칙주의자이고 개혁적 성향이 있으며 정치권에 몸을 오랫동안 담지 않았기 때문에 참신성 등을 고려했다”고 말했다. 그러면서 “향후 혁신기구 명칭, 과제, 역할 이런 것은 혁신기구에서 김 교수와 혁신위원이 논의할 예정으로 논의 결과는 당 지도부가 전폭 수용할 계획”이라고 설명했다. 한 당직자는 “후보로 거론됐던 정근식 서울대 명예교수, 김태일 장안대 전 총장과 비교하면 상대적으로 젋고 여성이라 혁신 이미지에 맞는다는 것을 감안한 인선으로 보인다”고 했다.
김 교수는 한국외대 법학과를 졸업하고 독일 만하임대에서 법학 박사 학위를 받았다. 2015년 민주당의 전신인 새정치민주연합에서 문재인 대표 시절 당무감사위원을 맡았고, 문재인 정부 출범 이후 2020년 여성 최초 금융감독원 부원장으로 임명됐다. 지난 5일 임명 9시간 만에 ‘천안함 자폭’ 발언 논란 등으로 낙마한 이래경 다른백년 명예이사장과 비교하면 친이재명 색채가 약하다는 평가가 나온다.
민주당 지도부는 이 명예이사장이 낙마한 이후 새 혁신기구 책임자를 찾는 과정에서 후보군의 소셜미디어 게시글과 재산 형성 과정을 철저 검증했다고 한다. 김 교수는 서울 서초구에 지난 2020년 기준 공시가로 도합 36억원에 달하는 2주택을 보유하고 있는 것으로 나타났다. 그러나 민주당은 한 채는 남편과 사별하면서 상속받은 것으로, 법정 상속 비율에 따라 두 아들과 지분을 나눠갖고 있어 결격 사유가 되지 않는다고 보고 있다.
그러나 혁신기구가 당내 계파 갈등을 잠재울 수 있을지는 불투명하다. 비명계는 개딸 등 강성 지지층과 선을 긋고 이 대표 퇴진까지 포함한 당 체질 개선이 필요하다는 입장이다. 그러나 친명계는 대의원제 폐지와 현역 의원 기득권 타파가 혁신이라고 주장하고 있다.",https://www.chosun.com/politics/assembly/2023/06/16/GOIVRVC2T5D53CGJVCLOAIBTUQ/,2023-06-16,"더불어민주당이 김은경 한국외대 법학전문대학원 교수를 혁신기구 책임자로 임명했다. 권칠승 수석대변인은 김 교수를 선정한 이유로 원칙주의자이고 개혁적 성향을 강조했다. 김 교수는 독일에서 법학 박사 학위를 받은 후 문재인 대표 시절 당무감사위원을 맡았고, 여성 최초로 금융감독원 부원장으로 임명된 경력을 가지고 있다. 김 교수는 36억원 상당의 주택 2채를 보유하고 있지만, 상속받은 것이라 결격 사유가 되지 않는다고 밝혔다."
"의원수 축소, 불체포 포기, 무노동·무임금… 與, 3대 개혁 나선다","국민의힘 김기현 대표가 15일 취임 100일 기자회견에서 그동안의 주요 성과와 당이 앞으로 추진할 개혁 과제를 밝히고 있다. /뉴스1
국민의힘 김기현 대표는 ‘국회의원 정수 축소’ ‘불체포 특권 포기’ ‘무노동·무임금’을 3대 정치 개혁 과제로 내걸고 당론으로 추진하기로 했다. 김 대표는 오는 20일 국회 교섭단체 대표 연설에서 이와 관련한 구체적인 방안을 제시할 예정이다. 이에 대해 더불어민주당은 “정치 혐오 여론에 편승한 쇼”라고 비판했다.
김 대표는 15일 취임 100일 기자회견에서 “앞으로도 마찬가지로 당의 도덕성을 확고히 세워 국민 눈높이에 맞도록 하겠다”며 “불체포 특권 같은 구시대적 특권 포기를 말로만 하는 민주당과는 달리 실천했고 앞으로도 그렇게 하겠다”고 밝혔다. 의원 정수 축소에 대해서는 “국민의 요청이기도 하고 실제로 생산성 면에서 본다고 해도 국회의원 정수를 굳이 300명으로 유지할 이유가 없다고 확신한다”고 했다. 앞서 김 대표는 지난 4월 당 회의에서도 “의원 수를 최소 30석 이상 줄일 수 있다고 본다”고 했었다. 김 대표는 253석인 지역구보다는 47석인 비례대표를 우선적으로 줄이는 안을 검토하는 것으로 전해졌다.
김 대표는 국회의원에 ‘무노동·무임금 원칙’을 적용하는 정치 개혁안도 구상하고 있는 것으로 전해졌다. 국민의힘 관계자는 “민주당 출신 김남국 의원이 ‘코인 사태’로 칩거하는 동안에도 꼬박꼬박 세비를 받아 비판 여론이 높아진 것을 계기로, 일한 만큼 세비를 받도록 당 차원에서 제도를 고쳐 나가려 한다”며 “김 대표의 개혁안에 민주당이 동의하지 않는다면, 스스로 특권 뒤에 숨고 있다고 자인하는 꼴이 될 것”이라고 했다.
이에 대해 민주당 관계자는 “불체포 특권 폐지는 개헌을 해야 하고 의원 정수 축소도 단시간에 합의가 쉽지 않은 사안인데, 주장만 한다고 개혁이라고 할 수 있느냐”며 “존재감 없는 당대표의 국면 전환용 카드일 뿐”라고 했다.
한편, 김 대표는 이날 취임 100일의 주요 성과로 ‘당 안정화’와 ‘건강한 여당·정부·대통령실 관계’를 꼽으며 “앞으로는 외연 확장에 더 많은 힘을 기울이겠다”고 했다. ‘당이 대통령실에 끌려다니는 종속적 관계가 아니냐’는 지적에는 “전혀 동의하지 않는다. 한목소리, 원팀으로 건강한 하모니를 이루고 있다”고 했다. 총선 승리 전략에 대해서는 “도깨비방망이식 비결, 이런 게 있다고는 생각하지 않는다”며 “금방 들통나는 ’사이다 정치’가 아니라 진정성을 갖고 숙성시키는 ‘와인 정치’를 하겠다”고 했다.",https://www.chosun.com/politics/2023/06/16/TSUB7B4N4BEG7JVKJRZ7ZYWRMU/,2023-06-16,"국민의힘 김기현 대표는 15일 취임 100일 기자회견에서 국회의원 정수 축소, 불체포 특권 포기, 무노동·무임금을 정치 개혁 과제로 제시했다. 국회의원 수를 300명에서 줄일 예정이며, 무노동·무임금 원칙을 도입할 계획이다. 김 대표는 민주당의 비판에 대해 특권 뒤에 숨는다고 지적하며 개혁을 강조했다."
“교육당국·사교육 이권 카르텔”... 尹 교육개혁의 신호탄,"윤석열 대통령이 5월 31일 청와대 영빈관에서 열린 사회보장 전략회의에서 모두발언을 하고 있다. /뉴스1
윤석열 대통령이 15일 “공교육 교과 과정에서 다루지 않는 분야의 문제는 대학수학능력시험(수능) 출제에서 배제해야 한다”고 이주호 사회부총리 겸 교육부 장관에게 지시했다.
윤 대통령은 이날 이 부총리 업무 보고를 받고 “과도한 배경지식을 요구하거나 대학 전공 수준의 비문학 문항 등 공교육에서 다루지 않는 부분의 문제를 수능에서 출제하면 이런 것은 무조건 사교육에 의존하라는 것 아닌가. 교육 당국과 사교육 산업이 한편(카르텔)이란 말인가”라고 했다고 대통령실이 전했다. 국어·수학·과학 등 여러 과목을 접목한 이른바 통합형 문제나 지나치게 어려운 ‘킬러 문항’을 지양해야 한다는 것이다. 수능을 쉽게 내라는 뜻이다.
이에 따라 올해 11월 16일 치르는 2024학년도 수능부터 쉽게 출제될 것으로 보인다. ‘킬러 문항’은 사라지고, 비틀어내는 문제도 줄어들 전망이다. 이렇게 되면 어려운 문제를 반복해 풀기 위해 학원에 의존해야 하는 부담도 감소할 것으로 보인다. 교육계에선 윤 대통령의 ‘사교육 이권 카르텔’ 발언이 사교육 부담을 줄이면서 공교육에 힘을 싣는 ‘교육 개혁의 신호탄’이라는 해석이 나온다. 윤 대통령은 “최근 사교육비가 증가하는 상황에서 정부는 사교육비 경감 방안을 강력히 추진하라”고도 했다.
그러나 너무 쉬운 ‘물수능’이 되면 상위권 학생들은 한 문제만 실수해도 수능 등급이 바뀌는 등 혼란을 겪을 수 있다. 난이도 조절이 중요해졌다는 분석이 나온다.
윤 대통령은 대학 개혁에 대해선 “교육 수요자가 배우고 싶은 것을 배울 수 있도록 공급자인 대학이 유연하게 대응해야 한다”며 “정부와 기업, 교육기관이 삼위일체가 돼야 한다”고 했다. 윤 대통령은 특히 “대학이 학과와 전공 간 벽을 허물고 구조가 유연해야 경쟁력이 높아진다”며 “대학 안팎의 벽을 허무는 혁신적 대학을 전폭 지원하라”고 했다.
윤 대통령은 또 “세계 최고 수준의 영·유아 교육과 돌봄을 목표로 하라”며 “이를 위해 관리 체계를 교육부로 일원화하고 복지부와 협력해 국민이 체감하는 유보(유아교육·보육) 통합을 완성하라”고 했다. 정부 관계자는 “교육부가 중심이 돼 어린이 돌봄을 맡게 됐다”고 했다.",https://www.chosun.com/politics/politics_general/2023/06/16/5C67SLLVI5GGTKGAQEVWKMVZ4U/,2023-06-16,"윤석열 대통령은 사교육 의존 문제 해소를 위해 수능에서 어려운 문항과 '킬러 문항'을 줄이고, 2024 수능부터 쉽게 출제될 것으로 예상됩니다. 이는 사교육 부담을 줄이고 공교육 강화를 의미하며, 대학 개혁을 통해 유연한 교육 환경을 조성하고자 합니다. 또한, 세계 수준의 영·유아 교육과 돌봄 강화를 위해 국민이 체감할 수 있는 유아교육·보육 통합을 완성하라고 촉구했습니다."
