제목,본문,URL,날짜,요약
"부산시의회, 특수교육 현장 여건 개선 토론회 개최","부산시의회 교육위원회는 부산교사노동조합과 18일 오후 시의회에서 '특수교육, 부산이 묻고 답한다'를 주제로 토론회를 했다. 박경옥 대구대 교수는 '특수교육 문제와 개선방안' 주제 발표에서 ""우리나라 특수교육 현장은 과밀학급, 예산과 전문 인력 부족 등 여러 문제에 직면해 있는데 이런 문제를 해결하기 위해서는 법적·제도적 개선뿐 아니라, 지역 간 격차 해소와 현장 교사들의 업무 경감을 위한 실질적인 지원 체계가 마련돼야 한다""고 주문했다. 강무길 부산시의회 교육위원회 위원장은 ""부산 특수교육 대상 학생과 선생님들이 행복한 교육환경을 만들어가는 것이 우리 모두를 위한 포용 사회의 첫걸음""이라며 ""실질적인 현장 변화를 위해 논의된 과제를 주요 의정 과제로 관리해 나가겠다""고 말했다.",https://www.yna.co.kr/view/AKR20250418112500051,2025-04-18,"부산시의회 교육위원회는 부산교사노동조합과 함께 '특수교육, 부산이 묻고 답한다' 주제로 토론회를 열었다. 대구대 교수는 특수교육 현장의 문제로 과밀학급, 예산 부족, 전문 인력 부족을 지적하며 법적·제도적 개선과 지역 간 격차 해소, 교사 업무 경감을 위한 지원 체계를 요구했다. 부산시의회 교육위원회 위원장은 특수교육 대상 학생과 선생님들을 위한 행복한 교육환경 조성을 강조하며 현장 변화를 위한 논의된 과제를 주요 의정 과제로 채택할 것을 약속했다."
“제주 특수교육 아이들에게는 더 세심한 손길 필요하다”,"장애인의 날(4.20)을 맞아 민주노총 공공운수노조 전국교육공무직본부 제주지부는 18일 보도자료를 내고 특수교육 재정 확충 등 구조 개선을 요구했다. 교육공무직노조는 “특수교육 학생들의 교육권은 차별받고 학생들을 지원하는 특수교육실무원도 무시와 저임금, 과중한 업무 등 각종 차별에 방치돼 있다. 휴식 시간까지 교실과 복도, 급식실, 운동장, 화장실에서도 장애학생의 특수교육을 지키지만, ‘보조’라는 낙인과 차별을 겪는다”고 말했다. 이들은 “방학이면 최저임금도 안되는 기본급도 사라진다. 산업재해로부터 보호받지 못하고 수당은 지역마다 차이가 있다. 2024년 기준 전국 특수교육 대상자는 11만5610명에 달하며, 이중 8만5220명(73.7%)이 일반 학교에 다닌다. 통합교육 정책이 강화되면서 특수교육 교원과 지원인력 확충 필요성도 매년 커지고 있다”고 강조했다. 교육공무직노조는 “특수교육 지원인력은 배치 기준도 없어 부족한 예산 내에 한시적으로 채용된다. 방학중 비근무, 휴게 시간 미보장, 산재보호 부실, 지역별 수당 격차 등으로 장기적으로 일할 수 없는 구조”라고 주장했다. 이어 “특수교육은 제도에 더해 사람으로 완성된다. ‘장애를 가진 우리 학생들이 가장 힘듭니다. 매일 매일이 도전인 우리 아이들이 보여주는 미소와 작은 성취는 우리의 버팀목’이라는 보람으로 버티지만, 더는 보람만으로 버티라고 하지 말라”고 덧붙였다. 교육공무직노조는 “아이들을 위한 세심한 손길, 우리 학생들을 이해하고 지켜주는 숙련되고 전문적인 일손이 필요하다. 국가의 책임과 지원이 더 필요하다. 아프고 약한 아이들의 곁은 더 안전해야 하고 더욱 풍성해야 한다. 장애 학생의 가정과 학교가 그래야 한다”며 특수교육 재정과 인력 확충, 특수교육법 시행규칙 개정, 특수교육실무원 저임금 구조 개선, 늘범지원 대책 마련, 산재 전면 적용 등을 요구했다.",https://www.jejusori.net/news/articleView.html?idxno=435721,2025-04-18,"민주노총 공공운수노조 전국교육공무직본부 제주지부는 특수교육 재정 확충과 구조 개선을 요구했다. 특수교육실무원들이 무시당하고 저임금을 받으며 각종 차별을 겪고 있다고 밝혔다. 2024년 기준으로 전국 특수교육 대상자는 11만5610명 중 73.7%가 일반 학교에 다니며, 특수교육 교원과 지원인력 확충이 필요하다고 강조했다. 특수교육 지원인력의 부족과 임금 구조 개선, 산재 전면 적용 등을 요구하며, 국가의 더 많은 지원이 필요하다고 주장했다."
계양구 유일 특수학교 '인혜학교' 통학구역 확대… 학부모 우려 느는 까닭은,"인천 계양구 장기동에 소재한 인혜학교 정문.사진=노선우기자 인천 계양구 유일의 특수학교인 인혜학교의 통학구역이 확대·지정되면서 계양구 내 특수교육 대상자 학부모의 우려가 커지고 있다. 17일 인천시교육청 등에 따르면 인혜학교에 지원할 수 있는 통학구역은 기존 계양구 전체와 부평구 삼산·갈산동, 서구 원당·아라동에서 올해부터 서구 불로·마전동까지 확대됐다. 현재 서구에는 서희학교라는 특수학교가 당하동에 있지만, 검단신도시 등 지역 내 높은 수요를 분산하고자 이같이 조치한 것으로 알려졌다. 하지만 계양구 학부모들은 인천시의 이번 결정이 인혜학교 지원자 증가로 이어질 것이라며 개선을 요구하고 있다. 내년에 특수교육 대상자인 자녀가 초등학교 입학을 앞둔 주재홍(39·남) 씨는 ""서구 불로동·마전동과 가까운 특수학교가 있는데도 통학구역을 확대 지정했다""며 ""서구 쪽은 선택지가 2곳(서희학교·인혜학교)인데 계양구는 인혜학교가 아닌 다른 곳은 거리가 멀어 입학이 어렵다""고 했다. 그러면서 ""특수학교 학부모는 그저 교육청의 입학 심사 결과 통보에 따를 수밖에 없는 상황""이라고 했다. 문미혜(더불어민주당·계양구라) 계양구의원은 이에 지난 14일 열린 제259회 임시회 제1차 본회의에서 교육청 등의 대책을 촉구하기도 했다. 문 의원은 ""거주지역 내 학교조차 이용하지 못하는 역차별 해결을 위해 계양구 학생에게 우선권을 부여하는 등의 대책을 마련해야 한다""며 ""특수교육 대상 학생의 권익이 보장될 수 있도록 해야 한다""고 했다. 인천시교육청은 통학구역 확대가 법에 근거한 조치라며 논란이 증폭된 측면이 있다고 해명했다. 교육청 관계자는 ""특수교육법에 따라 구에 상관없이 1시간 이내 거리를 통학구역으로 지정할 수 있다""며 ""서구 서희학교가 검단신도시의 많은 학생을 수용할 수 없어 논의 끝에 인혜학교도 통학구역에 포함시킨 것""이라고 했다. 이어 ""올해 불로동과 마전동에서 인혜학교에 입학한 학생은 1명뿐""이라며 ""특수학교가 구별로 마련되지 않아 이 같은 상황이 벌어지고 있는 것이 안타깝다""고 전했다. 노선우기자",https://www.joongboo.com/news/articleView.html?idxno=363690354,2025-04-17,"인천 계양구의 인혜학교 통학구역이 확대되면서 계양구 내 특수교육 대상자 학부모들의 우려가 커지고 있다. 서구 불로동과 마전동 지역도 이번 확대에 포함되었는데, 계양구 학부모들은 이 결정이 인혜학교 지원자 증가로 이어질 것을 우려하며 개선을 요구하고 있다. 인천시교육청은 특수교육법에 따라 통학구역을 지정한 것으로 밝히고, 특수학교를 구별로 마련해야 한다는 점을 강조했다."
"[포토] 충남119특수대응단, 봄철 산악사고 특별훈련","산악사고 대비 훈련/충남119특수대응단 제공 (충남=국제뉴스) 박의규 기자 = 충남119특수대응단(단장 이주진)은 지난 17일 천안 동남구 태조산 일원에서 봄철 산악사고 특별훈련을 실시했다고 밝혔다. 이번 훈련은 봄철 등산객 증가에 따른 실족, 추락 등 산악사고 발생 시 신속한 구조활동을 통해 인명피해를 최소화하고 산악구조 기술을 숙달하기 위해 추진됐다. 주요 훈련 내용으로는 ▲ 산악사고 구조 기법 ▲ 산악구조장비 사용법 ▲ 봄철 산악사고 위험요소 분석 ▲ 산악지형에 따른 구조기법 훈련 등으로 진행됐다. 이주진 119특수대응단장은 ""산악구조는 높은 기술력이 요구되는 만큼 철저한 훈련과 반복적인 훈련이 필수""라며 ""이번 훈련을 통해 충남도민의 안전을 위해 다양한 형태의 훈련을 지속적으로 추진하겠다""고 말했다.",https://www.gukjenews.com/news/articleView.html?idxno=3254229,2025-04-18,"충남119특수대응단은 봄철 산악사고 대비를 위해 태조산에서 특별훈련을 실시했다. 이번 훈련은 등산객 증가로 인한 사고에 대비하여 신속한 구조활동을 통해 피해 최소화를 목표로 진행되었고, 주요 내용은 산악사고 구조 기법, 장비 사용법, 위험요소 분석, 산악지형에 따른 구조기법 훈련 등이었다. 이주진 단장은 ""산악구조 기술 향상을 위해 철저하고 반복적인 훈련이 필수""라며, 계속해서 다양한 훈련을 실시할 것을 강조했다."
"경기도교육청, '위드 어스' 특수교육 서포터즈 출범","발대식 현장 사진 [오늘경제 최영주 기자] 경기도교육청이 제45회 장애인의 날을 맞아 '2025 경기특수교육 서포터즈 위드 어스(With Us)' 발대식을 개최했다. 이번 서포터즈는 현장 중심의 특수교육 정책을 발굴하고자 공개 모집으로 선발된 이들로, 유·초·중·고·특수학교 교원, 학부모, 교육행정직, 단체 대표 등이 참여해 총 8개 분야로 나뉘어 활동을 시작했다. 17일 경기도교육청 북부청사에서 열린 발대식에는 임태희 교육감을 비롯해 서포터즈 100여 명이 참석했다. 행사에서는 대표 위촉장 수여와 함께 경기특수교육 3개년 계획 추진 현황, 서포터즈의 역할 및 운영 방향이 공유됐으며, 교육정책 보편적 설계와 특수학교 늘봄 운영 등 주요 정책에 대해 분과별 협의가 이뤄졌다. 임 교육감은 ""경기특수교육 서포터즈 '위드 어스' 활동에 함께해 주신 모든 분께 깊이 감사드린다""며 ""함께 뛸 때 힘든 여정도 완주할 수 있다는 경험처럼, 여러분의 힘으로 경기교육이 지향하는 '한 사람도 소외되지 않는 교육'이 실현되리라 믿는다""고 말했다. 도교육청은 향후 학령기 학생의 맞춤형 지원을 넘어 졸업 이후의 직업·사회 적응까지 포괄하는 특수교육 강화를 목표로, 관련 부서 간 협업을 통해 정책 추진력을 높이고, 특수교사 증원 등 인력 문제 해결을 위해 중앙정부에 제도 개선도 적극 건의할 계획이다.",https://www.startuptoday.co.kr/news/articleView.html?idxno=436868,2025-04-18,"경기도교육청은 '2025 경기특수교육 서포터즈 위드 어스' 발대식을 열어 100여 명의 서포터즈가 선발되어 활동을 시작했다. 발대식에서는 서포터즈의 역할과 경기특수교육 정책에 대한 협의가 이뤄졌으며, 임태희 교육감은 참석자들에게 감사의 말을 전하고 향후 특수교육 강화를 위한 계획을 발표했다. 경기도교육청은 특수교육의 질을 향상시키기 위해 중앙정부에 제도 개선을 건의할 예정이다."
"대전특수교육원, 찾아오는 장애공감교실 운영","""편견 없는 학교문화, 함께 만들어요"" 찾아오는 장애공감교실, 장애공감음악회 '온 앙상블'이 진행되는 모습 (사진 출처=대전교육청) 대전특수교육원은 4월18일부터 11월21일까지 관내 초·중학교 통합학급을 대상으로 '찾아오는 장애공감교실'을 운영한다고 밝혔다. 이번 프로그램은 비장애학생의 장애 감수성을 키우고 통합교육 여건 개선을 위해 기획되었으며 초·중학교 12교를 대상으로 실시한다. 통합학급 학생들이 행복동행버스를 이용, 특수교육원을 방문하여 장애인에 대한 상황별 에티켓, 보조공학기기를 활용한 장애 공감 활동, 장애예술인공연단과 함께하는 음악회 등 다양한 프로그램에 참여하게 된다. 대전도마중학교 통합학급 이○○ 교사는 '학생들이 장애공감교실에 참여하고 나서 세상을 바라보는 눈과 마음이 넓어진 것 같다.”며, “앞으로도 학생들의 눈높이에 맞게 장애를 다름으로 이해하고 공감할 수 있는 프로그램이 자주 운영되면 좋겠다.'고 소감을 밝혔다. [신아일보] 양주석 기자 jsyang@shinailbo.co.kr 저작권자 ? 신아일보 무단전재 및 재배포 금지",https://www.shinailbo.co.kr/news/articleView.html?idxno=2039925,2025-04-18,"대전특수교육원이 4월부터 11월까지 대전 초·중학교 통합학급을 대상으로 '찾아오는 장애공감교실'을 운영한다. 이 프로그램은 비장애학생의 장애 감수성을 키우고 통합교육 환경을 개선하기 위해 기획되었으며, 12교에서 진행된다. 학생들은 특수교육원을 방문하여 장애인에 대한 에티켓 교육과 장애 공감 활동, 장애예술인과 함께하는 음악회 등 다양한 프로그램에 참여하게 된다."
"인천시교육청, 특수교육 대상 학생을 위한 ‘숲속 생태체험 프로그램’ 운영","[사진출처=인천시교육청] [한국강사신문 최주리 시민기자] 인천광역시교육청(교육감 도성훈)은 특수교육 대상 학생들의 생태 감수성 향상과 정서적 안정을 위해 4월 14일부터 11월 14일까지 ‘2025학년도 숲속에서 하는 생태체험 프로그램’을 운영한다고 밝혔다. 기후 위기 대응은 물론 학생들의 심신 치유와 생명 존중 의식 함양을 목표로 하는 이번 프로그램은 숲 생태 탐방, 생물 다양성 관찰, 자연 소재 예술 활동, 생태 놀이와 명상 등 다채로운 활동으로 구성된다. 특히 학생의 발달 수준과 정서적 필요를 고려한 맞춤형 프로그램으로 운영되며, 전문 생태 강사와 특수교사의 협력으로 안전한 체험 환경을 제공한다. 인천시교육청 관계자는 “자연 속 생태체험은 특수교육 대상 학생들에게 의미 있는 교육 경험이 된다”며 “학생들의 다양한 특성과 필요를 존중하는 생태 교육이 학교 현장에 정착할 수 있도록 적극 지원하겠다”고 밝혔다.",https://www.lecturernews.com/news/articleView.html?idxno=176451,2025-04-18,"인천시교육청은 특수교육 대상 학생들을 위해 '2025학년도 숲속에서 하는 생태체험 프로그램'을 운영한다. 이 프로그램은 생태 탐방, 생물 다양성 관찰, 자연 소재 예술 활동, 생태 놀이, 명상 등으로 구성되어 있으며, 학생의 발달 수준과 정서적 필요를 고려한 맞춤형으로 진행된다. 전문 생태 강사와 특수교사의 협력으로 안전한 환경에서 진행되며, 인천시교육청은 이를 통해 학생들에게 의미 있는 교육 경험을 제공하고자 한다."
"광주시교육청, 특수교육 발전 기여자 표창 수여","(광주시교육청, 특수교육 발전 기여자 표창 수여)광주시교육청이 18일 광주특수교육지원센터 연수실에서 특수교육 발전 유공자에 대해 교육부 장관 표창장 및 교육장 표창장을 수여했다. 광주선우학교 특수교사 이순영, 광주선명학교 특수교사 이제나, 은혜학교 특수교사 박석일, 시교육청 주무관 박규성이 교육부장관 표창장을 수여받았다. 사진=광주광역시교육청 제공 [광주=데일리한국 봉채영 기자] 광주시교육청(교육감 이정선)은 ‘제45회 장애인의 날’을 맞아 18일 광주 특수교육지원센터 연수실에서 특수교육 발전 유공자에 대해 교육부장관 표창장 및 교육감 표창장을 수여했다. 시교육청은 매년 교육기관과 특수교육 현장에서 장애인식을 개선하고 특수교육 발전에 기여한 공로가 큰 교직원, 학생, 특수교육 지원인력, 지역 인사 등에게 교육부장관과 교육감 표창을 수여하고 있다. 이날 광주선명학교 이제나 교사, 광주선우학교 이순영 교사, 은혜학교 박석일 교사 등은 교원 부분, 시교육청 박규성 주무관은 일반직 공무원 부분 등 4명이 교육부장관 표창을 받았다. 또 학교 및 지역 기관에서 추천한 특수교육대상학생 5명, 특수교원 3명, 통합학급 담당교사 3명, 특수교육실무사 5명, 장애학생활동지원 사회복무요원 5명, 지역사회인사 3명 등 24명에 대해서는 교육감 표창이 수여됐다. 이정선 교육감은 “교육기관 및 특수교육 현장 등에서 장애인식 개선 및 특수교육발전을 위해 노력하고 애쓰는 모든 교육가족께 감사드린다”며 “특수교육대상학생들의 더 나은 삶을 위한 장애공감문화 조성 및 통합교육 환경 조성을 위해 더욱 노력하겠다”고 말했다.",https://daily.hankooki.com/news/articleView.html?idxno=1206136,2025-04-18,"광주시교육청은 교육부 장관과 교육장 표창장을 받은 특수교육 발전 유공자들을 포상했다. 광주선우학교 이순영, 광주선명학교 이제나, 은혜학교 박석일 특수교사, 박규성 주무관이 표창을 받았다. 또한 학생, 교원, 지원인력, 지역 인사 등 24명에게 교육감 표창이 수여되었으며, 교육감은 특수교육 발전을 위해 노력하는 모든 교육가족에게 감사의 인사를 전했다."
특수교육지도사 ‘보조’ 낙인 “임금차별에 업무과중”,"▲ 자료사진 학교비정규직노조 4월 20일 장애인의 날을 앞두고 특수교육지도사들이 ‘차별 철폐’를 주장했다. 이들은 임금제도 개선과 휴게시간 보장, 산재 보호 등을 요구하면서 정부와 교육청이 나서야 한다고 소리 높였다. 공공운수노조 교육공무직본부·장애인부모연대·평등교육실현전국학부모회·장애인차별철폐연대 등 장애인단체들은 18일 성명을 내고 특수교육지도사의 지위와 저임금 노동, 업무 과중 문제를 비판했다. 현장에서 장애인 특수교육을 책임지는 일선 노동자임에도 ‘보조’라는 낙인이 찍혀 각종 차별을 받고 있다는 지적이다. 장애인 등에 대한 특수교육법 시행규칙은 특수교육지도사를 교사의 지시에 따른 보조역할을 담당한다고 규정하고 있다. 지난해 기준 전국 특수교육대상자는 11만5천610명이며, 이중 8만5천220명이 일반학교로 통합돼 있다. 특수학급도 1만9천582개로 늘고 있고 특수교육 교원도 매년 증가하는 추세다. 그러나 특수교육 지원인력은 부족한 예산 내에서 한시적으로 채용하는 탓에 업무 과중이 만연한 상황이라고 특수교육지도사들은 토로한다. 부족한 인력 탓에 과로에 내몰리고 임금수준도 낮다. 단체에 따르면 특수교육지도사는 급식·돌봄·교무 등 교육청이 분류하는 교육공무직종 중에서도 임금이 가장 적다. 특수교육지도사는 월 2~5만원 수준의 특수업무지원수당을 받을 수 있는데 지역별로 상이하다. 지역에 따라 전혀 받지 못하는 경우도 있다. 단체는 교육청이 지역과 상관없이 수당을 전국적으로 통일해야 한다고 주장하고 있다. 방학 중 비근무중에는 임금을 지급받지 못한다는 점도 저임금 구조를 가중하는 요인이다. 산업재해 보호는 부실한 상황이다. 특수교육지도사는 시·도교육청이 학교 근무 노동자의 안전 상황을 점검하는 산업안전보건위원회에 참석할 수 없다. 단체는 “특수교육지도사들의 업무 과중, 산업재해, 임금차별은 국가 책임 회피의 단면”이라며 “교육청은 방학 중 비근무, 지원수당 차별 등 특수교육지도사 저임금 구조를 해소해야 한다”고 강조했다.",https://www.labortoday.co.kr/news/articleView.html?idxno=227470,2025-04-18,"장애인 특수교육지도사들이 임금 및 근로환경 개선을 요구하며 정부와 교육청에 대한 지원을 촉구하고 있다. 특수교육대상자는 11만5천610명 중 8만5천220명이 일반학교로 통합돼 있으며, 특수학급과 교원은 증가하는 추세이나 지원인력 부족으로 업무 과중이 심각한 상황이다. 특수교육지도사는 저임금 구조로 인해 월 2~5만원의 특수업무지원수당을 받지만, 일부 지역에서는 전혀 받지 못하는 경우도 있다.산업재해 보호 또한 부실한 상황이며, 교육청은 특수교육지도사의 업무 과중과 임금차별 문제를 해소해야 한다는 요구가 제기되고 있다."
"대전특수교육원, '찾아오는 장애공감교실' 운영","대전특수교육원이 오는 11월 21까지 관내 초·중학교 통합학급을 대상으로 '찾아오는 장애공감교실'을 운영한다.(사진=대전특수교육원) 대전특수교육원(원장 권순오)은 오는 11월 21까지 관내 초·중학교 통합학급을 대상으로 '찾아오는 장애공감교실'을 운영한다고 18일 밝혔다. 이번 프로그램은 비장애학생의 장애 감수성을 키우고 통합교육 여건 개선을 위해 기획되었으며 초·중학교 12교를 대상으로 실시한다. 통합학급 학생들이 행복동행버스 대전특수교육원에서 운영하는 교육활동 지원 차량의 명칭을 이용, 특수교육원을 방문해 장애인에 대한 상황별 에티켓, 보조공학기기를 활용한 장애 공감 활동, 장애예술인공연단과 함께하는 음악회 등 다양한 프로그램에 참여하게 된다. 대전특수교육원이 오는 11월 21까지 관내 초·중학교 통합학급을 대상으로 '찾아오는 장애공감교실'을 운영한다.(사진=대전특수교육원) 대전도마중학교 통합학급 한 교사는 ""학생들이 장애공감교실에 참여하고 나서 세상을 바라보는 눈과 마음이 넓어진 것 같다”며, “앞으로도 학생들의 눈높이에 맞게 장애를 다름으로 이해하고 공감할 수 있는 프로그램이 자주 운영되면 좋겠다""고 소감을 남겼다. 한편, 대전특수교육원은 오는 11월 말까지 장애인식개선 교육 전문 강사진이 관내 315개의 유·초·중·고등학교를 방문하여 학교 내 장애 공감 문화 조성을 위한 '찾아가는 장애이해교실'을 운영할 계획이다. 대전특수교육원 권순오 원장은 ""장애공감교실을 통해 장애 감수성을 높이고 장애에 대한 편견이 없는 학교문화가 확산되기를 기대한다.며, 앞으로도 모두가 존중받고 공감하는 장애 인식개선 교육을 위해 지원을 강화하겠다""라고 전했다.",https://www.newsfreezone.co.kr/news/articleView.html?idxno=621532,2025-04-18,"대전특수교육원은 11월 21일까지 초·중학교 통합학급을 대상으로 '찾아오는 장애공감교실'을 운영한다. 이 프로그램은 비장애학생의 장애 감수성을 높이고 통합교육 환경을 개선하기 위해 기획되었으며, 초·중학교 12곳을 대상으로 실시된다. 학생들은 대전특수교육원을 방문하여 다양한 프로그램에 참여하며 장애인에 대한 이해와 공감을 높인다. 대전특수교육원은 또한 11월 말까지 장애인식개선 교육을 위해 '찾아가는 장애이해교실'을 운영할 예정이며, 장애 감수성을 높이고 편견 없는 학교 문화 조성을 목표로 한다."
