제목,본문,URL,날짜,요약
尹 “제1연평해전 승전 24주년…압도적 힘만이 평화 가져온다”,"윤석열 대통령이 14일 청와대 영빈관에서 열린 국가유공자 및 보훈가족 초청 오찬에서 태극기를 배경으로 생각에 잠겨 있다./대통령실
윤석열 대통령은 15일 “북한의 무모한 도발에 단 한 순간의 주저함도 없이 단호하게 대응할 것”이라고 밝혔다.
윤 대통령은 이날 페이스북 글을 통해 “오늘로 제1연평해전 승전 24주년을 맞는다. 1999년 6월 15일은 휴전 이후 처음 발생한 남북 간 해상 교전에서 우리 군이 큰 승리를 거둔 날”이라며 이같이 말했다.
윤 대통령은 “(당시에) 북한은 꽃게잡이 어선 통제를 빌미로 북방한계선(NLL)을 침범해 무력 도발을 감행했다”며 “한 치의 망설임 없이 전투에 나섰던 우리 해군 장병들은 북한 경비함정들을 제압하고 NLL을 지켰다”고 적었다.
이어 “이들의 뜨거웠던 호국 정신은 후배 장병들에게 이어지고 있다”고 말했다.
윤 대통령은 “우리의 압도적인 힘만이 적에게 구걸하는 가짜 평화가 아닌, 진짜 평화를 가져다줄 것”이라며 “지금 이 순간에도 국토방위의 임무를 수행하고 있는 장병들의 노고에 감사드린다”고 했다. 그러면서 “자유와 평화, 번영을 위해 헌신한 영웅들을 잊지 않겠다”고 말했다.

관련 기사
‘文때 홀대’ 천안함 老母·천안함장, 尹은 옆에 앉혀 예우했다
천안함 막말 겨눈 尹 “영웅들 희생 왜곡·폄훼는 반국가행위”
‘70년 소외’ 납북자 가족, 대통령 처음 만났다",https://www.chosun.com/politics/blue_house/2023/06/15/D4Z4767Z5NGJFNSJB57UAISXOE/,2023-06-15,"윤석열 대통령은 국가유공자 및 보훈가족 초청 오찬에서 북한의 도발에 대해 단호한 대응을 약속했다. 또한, 1연평해전 승전 24주년을 맞아 남북 간 해상 교전에서의 승리를 회고하며, 당시 해군 장병들의 용기와 헌신을 칭찬했다. 우리 군의 힘으로 진짜 평화를 이루어낼 것을 강조하며, 국토방위 임무를 수행하는 장병들과 헌신한 영웅들에게 감사의 말을 전했다."
"“이웃 굶어 죽어”“김정은에 불만 가득”…北주민들, BBC와 비밀 인터뷰","현충일이자 절기상 망종인 지난 6일 오전 경기 파주시 오두산통일전망대에서 바라본 북한 황해북도 개풍군 임진강변 마을에서 주민들이 농사를 짓고 있다. /뉴스1
북한에서 식량 부족으로 이웃이 굶어 죽었다는 북한 주민들의 증언이 나왔다.
BBC는 14일(현지시각) 북한 전문 매체 데일리NK의 지원으로 평양과 중국 국경 근처 마을 등에 거주하는 일반 주민 3명을 인터뷰했다고 밝혔다.
이들 북한 주민들은 북중간 국경이 폐쇄된 이후로 굶어 죽거나 법 위반으로 처형당할까 봐 두렵다고 말했다.
전문가들은 인터뷰에 묘사된 북한의 상황이 1990년대 ‘고난의 행군’ 이후 최악임을 시사한다고 말했다고 BBC는 전했다.
BBC에 따르면 평양에 사는 지연(이하 모두 가명)이란 이름의 한 여성은 집에서 굶어 죽은 세 식구에 대해 털어놨다. 그는 “물을 주려고 문을 두드렸지만 아무도 대답하지 않았다”고 했다. 당국에서 안에 들어가 봤지만 이미 숨진 상태였다고 그는 전했다.
또 지연씨는 사람들이 살 수가 없어서 집에서 목숨을 끊거나 죽으려고 산으로 들어간다는 얘기를 들었다고도 말했다.
중국 국경 근처에 사는 건설 노동자 찬호씨는 극심한 식량 공급 부족으로 마을에서 5명이 굶어 죽었다고 말했다. 그는 “처음엔 코로나로 죽을까 봐 무서웠지만 이후엔 굶어 죽을까 봐 걱정되기 시작했다”고 말했다.
장마당에서 중국 밀수품을 파는 상인 명숙씨는 과거 장마당에서 팔리는 제품 4분의 3이 중국에서 왔지만 현재는 팔 수 있는 물건이 비어있다고 말했다.
이 때문에 수입이 대폭 줄었고 가족들과 먹을 음식조차 구하기 어려운 상황이다. 최근에는 배가 고픈 사람들이 음식을 구하기 위해 자신의 집 문을 두드리고 있다고 그는 덧붙였다.
북한 경제학자 피터 워드는 “평범한 중산층의 이웃이 굶어 죽는 것은 매우 우려스럽다”며 “아직 전면적 사회 붕괴나 대규모 아사가 발생한 것은 아니지만 좋지 않아 보인다”고 말했다.
북한 인권침해를 기록하는 NKDB의 송한나씨도 “지난 10∼15년간 아사 사례는 거의 못 들어봤다. 북한 역사상 가장 어려운 시기를 떠올리게 된다”고 말했다.
북한 노동당 기관지 노동신문은 ""풍요한 가을을 안아올 한 마음""으로 씨뿌리기 작업을 기술적 요구에 맞춰 하는 등 각지 농장이 농사를 잘 짓기 위한 경쟁 열의를 펼치고 있다고 보도했다. /노동신문 연합뉴스
한국 정부 발표에 따르면 코로나 사태 전에는 하루 1000명 이상이 압록강을 건너 중국으로 탈출했으나 명숙씨는 이제는 탈출이 불가능해졌다고 말했다. 그는 “지금은 강에 가까이만 가도 가혹한 처벌을 받을 것이라서 아무도 건너가지 않는다”고 말했다.
찬호씨는 친구 아들이 최근 비공개 처형을 여러 건 목격했으며, 건마다 3∼4명이 탈출 시도를 하다 잡혀 와서 처형됐다고 말했다. 그는 “매일 매일 살기가 더 힘들어진다. 한 번 잘못 움직이면 처형”이라며 “우리는 여기 갇혀서 죽기만 기다리고 있다”고 말했다.
김정은 북한 국무위원장도 최근 식량 위기를 공개적으로 언급하는 등 상황의 심각성을 시사했지만, BBC는 그가 여전히 핵무기 개발을 우선시하고 있다고 지적했다.
관련 기사
北 식량난 얼마나 심각하기에… 꽃제비 다시 등장
北주민들, 식량난으로 4월부터 보릿고개 “하루 두끼 겨우 먹어”
통일부 “北 식량난 심각, 굶어죽는 주민 속출...지원 바라는 듯”
북한은 지난 한 해에만 탄도미사일 63발 발사시험을 했는데 이 비용은 5억달러(약 6375억원)가 넘는 것으로 추산됐다. 이는 북한 연간 곡물 부족량을 메꾸고도 남는 규모라고 BBC는 덧붙였다.
상황이 이렇자 북한에서는 김정은 위원장에 대한 신뢰는 물론 주민들끼리의 신뢰도 무너졌다고 주민들은 말했다.
지연씨는 감시와 단속이 너무 무자비해서 사람들이 서로를 믿지 않는다고 말했다. 지연씨도 2020년 12월 통과된 새로운 법률에 따라 외국 영화, TV프로그램, 노래를 소비하다 적발돼 체포된 적이 있다고 했다.
명숙씨는 “코로나 이전엔 사람들이 김정은을 긍정적으로 봤지만 이제 거의 모든 사람들이 그에 대한 불만으로 가득 차 있다”고 말했다.",https://www.chosun.com/politics/north_korea/2023/06/15/JDJBNZQI5VGJDMWRALAF7ESCU4/,2023-06-15,"한국 경기도 파주시에서 북한 황해북도 개풍군을 바라보는 주민들의 농사 모습이 전해졌다. BBC는 북한 주민들의 증언을 통해 굶주림으로 이웃이 죽는 상황이 심각하다고 전했는데, 중국 국경 근처에 사는 주민들은 굶어 죽거나 처형당할까 봐 두렵다고 말했다. 북한 경제학자는 이러한 상황이 1990년대 '고난의 행군' 이후 최악이라고 지적했다. 김정은 정권의 식량 위기 공개 발언에도 불구하고, 주민들은 김정은에 대한 불신과 불만을 털어놨다.북한은 한 해에 63발의 탄도미사일 발사시험을 진행하며 5억달러 이상을 소비했는데, 이는 식량 부족량을 메꾸기에 충분한 규모라고 BBC는 전했다. 현재 상황에서 주민들은 감시와 단속으로 서로를 믿지 않는 상황이라고 전했다."
"실신한 장경태, 무릎보호대 착용? “절대 아냐, 법적 대응”","방통위 항의 방문을 나선 장경태 더불어민주당 최고위원이 14일 경기 과천시 정부과천청사 방송통신위원회에 앞에서 성명서를 낭독하던 중 쓰러져 주변의 도움을 받아 휴식을 취하고 있다. /뉴스1
방송통신위원회에서 성명서를 낭독하던 중 쓰러진 장경태 더불어민주당 최고위원이 당시 무릎보호대를 착용하고 있었다는 의혹이 온라인에서 확산했다. 장 최고위원은 “말도 안 되는 의혹”이라며 법적 대응을 예고했다.
장 최고위원은 14일 과학기술정보방송통신위원회 민주당 간사 조승래 의원과 방통위 앞에서 성명을 발표했다. 정부가 추진하는 KBS 수신료 분리 징수를 위한 방송법 시행령 개정에 항의하는 내용이었다. 조 의원이 성명서를 읽던 중 옆에 있던 장 최고위원이 갑자기 쓰러졌다. 그는 기침하며 몸을 앞으로 수그리더니 그대로 바닥으로 고꾸라졌다. 2~3초 뒤 부축을 받고 정신을 차린 장 최고위원은 한동안 호흡을 가다듬다 차로 들어가 휴식을 취했다.
장 최고위원 측 관계자는 “장 의원이 서 있던 중 일시적인 빈혈이 왔다”며 “잠시 휴식을 취하고 괜찮아졌다”고 밝혔다.
한 네티즌이 14알 장경태 민주당 최고위원의 무릎보호대 착용 의혹을 제기했다. /온라인 커뮤니티
이후 일부 온라인 커뮤니티에서는 장 최고위원이 무릎보호대를 착용하고 있었다는 의혹이 제기됐다. 쓰러질 것을 먼저 예상하고 다치지 않기 위해 무릎보호대를 착용한 것 아니냐는 게 주장의 요지다. 네티즌들은 주저앉아 있는 장 최고위원의 무릎 부분이 다소 불룩하게 튀어나온 것처럼 보이는 사진을 근거로 삼았다.
장 최고위원은 의혹을 전면 부인했다. 그는 “무릎보호대를 하면 양반다리를 할 수 없고, 특히 정장 바지는 늘어나지 않는 재질이라 바지 안에 보호대 같은 것을 넣을 수 없다”며 “말도 안 되는 의혹을 제기한 네티즌에 대해 법적 조치를 할 예정”이라고 국민일보에 말했다.
관련 기사
방통위 항의 방문한 장경태, 성명서 읽다 돌연 실신
한편 장 최고위원과 조 의원은 ‘과방위 소속 민주당 의원 일동’ 명의 성명에서 “무리한 방통위 운영은 KBS, MBC 방송 장악을 위한 방통위 사전 접수로밖에 이해할 수 없다”며 “새로운 정책 결정 논의를 당장 중단하라”고 했다. 이들은 또 “윤석열 대통령은 국회에서 추천한 최민희 상임위원 후보를 이유 없이 임명하지 않고 있다”며 “방통위 정상화부터 결자해지하라”고 했다.",https://www.chosun.com/politics/politics_general/2023/06/15/7ARMDMM6KJA3LC4AM7MDLEH3QA/,2023-06-15,"장경태 더불어민주당 최고위원이 방송통신위원회에서 성명서를 낭독하던 중 쓰러지는 사건이 발생했다. 그러나 무릎보호대 착용 의혹에 대해 장 최고위원은 ""말도 안 되는 의혹""이라며 법적 대응을 예고했다. 장 최고위원은 쓰러진 후 일시적인 빈혈로 인해 휴식을 취했으며, 관계자는 장 의원이 괜찮다고 밝혔다."
[단독] 방통위 감사 조직 4배 이상으로 확대,"방송통신심의위원회 현판.
방송통신위원회가 감사원과 검찰, 경찰, 국세청으로부터 인력을 파견받아 10여 명 규모의 자체 감사 조직을 구성한다. 새 감사 조직은 MBC·TBS에 유리하게 ‘편파 심의’를 해 왔다는 논란에 휩싸인 방송통신심의위원회(방심위)를 비롯해, 방통위의 감독 대상 기관들에 대한 검사와 감찰에 투입된다.
14일 방통위와 감사원에 따르면, 방통위는 이날 감사원과 검찰, 경찰, 국세청으로부터 9명을 파견받았다. 감사원 감사관 4명, 검찰 수사관 2명, 경찰관 2명, 국세청 조사관 1명 등이다. 기존에 방통위에는 감사 업무를 담당하는 직원이 3명 있었다. 방통위는 여기에 파견받은 인력을 더해 감사 업무 담당자를 10여 명으로 늘리고, 과(科)에 해당하는 감사담당관실을 신설하기로 했다. 기존 감사 조직 규모가 4배 이상으로 확대되는 것이다. 방통위가 이 정도 규모의 자체 감사 조직을 갖춘 것은 전례가 없다.
방통위는 파견받은 인력을 지난달부터 진행하고 있는 방심위와 한국교육방송공사(EBS)에 대한 검사에 우선 투입하기로 했다. 방심위가 노무현 정부 시기 KBS 사장을 지낸 정연주 위원장 체제에서 처음으로 받는 검사다. 지난달 ‘공정언론국민연대’ 등 보수 단체들은 방심위가 방송 심의를 야권에 유리하게 해 왔고, 방심위 고위 관계자들이 업무추진비를 부정하게 쓴 의혹이 있다며 방심위에 대한 공익감사를 감사원에 청구했다. 감사원이 감사 실시 여부를 검토하고 있는 가운데, 감사원에서 파견된 감사관들이 방심위를 들여다보게 된 것이다. 방통위 고위 관계자는 “보강된 인력은 방심위와 EBS에 지급된 보조금이 적정하게 집행됐는지를 점검하고, 향후 방통위 내부 기강 확립과 산하 기관들에 대한 직무 감찰 활동에도 투입될 것”이라고 했다.
앞서 윤석열 대통령은 지난달 30일 TV조선 재승인 심사 점수 조작 혐의로 기소된 한상혁 방통위원장을 면직하고, 이틀 뒤인 1일 방통위의 살림살이를 총괄하는 방통위 사무처장 자리에 조성은 감사원 감사교육원장을 임명했다.",https://www.chosun.com/politics/goverment/2023/06/15/I7NEFSILT5AX7O7QMXZLZEA5HE/,2023-06-15,"방송통신위원회가 감사원, 검찰, 경찰, 국세청으로부터 인력을 파견받아 10여 명 규모의 자체 감사 조직을 구성했다. 새 감사 조직은 MBC·TBS에 유리하게 ‘편파 심의’를 한 것으로 알려진 방송통신심의위원회(방심위)를 비롯한 감독 대상 기관들을 검사하고 감찰할 예정이다. 감사원, 검찰, 경찰, 국세청 등으로부터 파견받은 9명의 인력을 추가로 투입하여 감사 업무 담당자를 10여 명으로 늘리고, 감사담당관실을 신설하며 기존 감사 조직 규모를 4배 이상으로 확대했다."
"文정부 태양광 확대...靑선 김수현·문미옥·채희봉, 산업부선 백운규 주도","문재인 전 대통령이 지난 2018년 10월 30일 전북 군산시 유수지 수상태양광부지에서 열린 '새만금 재생에너지 비전 선포식' 행사를 마치고 수상태양광 시설을 둘러보고 있다. (왼쪽부터) 당시 문 대통령, 송하진 전북도지사, 성윤모 산업통상자원부 장관, 김현미 국토교통부 장관./연합뉴스
감사원 감사로 드러난 태양광 등 신재생에너지 비리는 문재인 정부의 무리한 탈원전 밀어붙이기에서 출발했다. 문재인 정부는 출범 다음 달인 2017년 6월 신재생에너지 확대를 위해 정부, 학계, 기업 등이 참여하는 태스크포스(TF)를 만들고, 그해 12월 ‘재생에너지 3020 이행 계획안’을 발표했다. 특히 신규 재생에너지 설비 용량의 63%를 태양광에 할당했다.
문재인 정부 당시 김수현 사회수석, 문미옥 과학기술보좌관, 채희봉 산업정책비서관, 백운규 산업통상자원부 장관(왼쪽부터).
문 정권 초기 탈원전과 신재생에너지 확대 업무는 문 대통령의 측근인 김수현 사회수석, 문미옥 과학기술보좌관, 산업통상자원부 에너지자원실장을 지낸 채희봉 산업정책비서관이 주도한 것으로 알려졌다. 김수현 수석은 청와대 정책실장으로 승진했고, 문미옥 보좌관은 과학기술정보통신부 차관을 거쳐 2021년 1월부터 과학기술정책연구원장으로 재직 중이다. 채희봉 비서관은 가스공사 사장을 지냈다.
초기 태양광 관련 실무는 백운규 산업통상자원부 장관이 맡았다. 산업부는 태양광 등 신재생에너지 사업 발굴을 위해 2018년 에너지신산업정책단을 신재생에너지정책단으로 개편하고 산하 4개 과에 40여 명을 배치했다.
한국전력은 산업부의 정책에 따라 태양광발전을 설치한 기업과 가정에 전기료를 인하해 주고, 소규모 태양광발전 시설을 우선적으로 전력망에 연결해 줬다. 노무현 정부 당시 산업부 1차관을 지낸 김종갑씨, 문재인 정부 두 번째 산업부 차관을 지낸 정승일씨가 한전 사장으로 재직했다.
관련 기사
尹, 검찰총장때 ‘운동권 태양광 비리’ 수사 지휘… 문제의식 많아
전력기금을 이용한 태양광 금융 지원은 산업부 산하 한국에너지공단이 담당했다. 전력기금은 전력 산업 발전 명목으로 국민이 내는 전기 요금에서 3.7%를 뗀 기금이다. 이상훈 이사장은 환경운동연합 정책실장, 녹색에너지전략연구소장 등을 지냈다.",https://www.chosun.com/politics/assembly/2023/06/15/VSMIGPOHZNE5VFLP2VRG66RI6M/,2023-06-15,"2017년 문재인 정부는 신재생에너지 확대를 위해 태스크포스를 구성하고, 재생에너지 3020 이행 계획안을 발표했으며, 63%를 태양광에 할당했다. 김수현 사회수석, 문미옥 과학기술보좌관, 채희봉 산업정책비서관이 탈원전 정책을 주도했고, 백운규 산업통상부 장관은 태양광 관련 실무를 담당했다. 전력기금을 이용한 태양광 금융 지원은 한국에너지공단이 담당했으며, 이상훈 이사장은 그 업무를 맡았다."
"국회 행안위원장에 김교흥, 환노위원장에 박정","국회는 14일 본회의를 열고 더불어민주당 몫 국회 상임위원장 6명을 선출했다. 행정안전위원장에는 김교흥 의원, 교육위원장에는 김철민 의원, 환경노동위원장에는 박정 의원, 보건복지위원장에는 신동근 의원, 산업통상자원중소벤처기업위원장에는 이재정 의원, 예산결산특별위원장에는 서삼석 의원이 각각 선출됐다. 모두 재선 의원이다. 이들 임기는 21대 국회 임기가 끝나는 내년 5월 29일까지다.
민주당 몫 상임위원장 선출은 지난달 30일 정청래 최고위원이 행안위원장 자리를 요구하고 나서면서 보름 가까이 진통을 겪었다. 정 최고위원은 지난 12일 의원총회에서 “선당 후사하겠다”며 당 방침에 따르기로 했다. 민주당은 이날 의총에서 당대표, 원내대표, 최고위원, 사무총장, 정책위의장 등은 상임위원장을 겸직하지 못한다는 원칙을 세웠다.",https://www.chosun.com/politics/assembly/2023/06/15/4Y5BC55W2ZEGZPOZUIE22HNUUA/,2023-06-15,"국회는 14일 더불어민주당 몫 국회 상임위원장 6명을 선출했는데, 행정안전위원장에는 김교흥 의원, 교육위원장에는 김철민 의원 등이 선출되었다. 이들은 21대 국회 임기가 끝나는 내년 5월 29일까지 임기를 맡게 된다. 민주당 몫 상임위원장 선출은 최고위원이 행안위원장 자리를 요구하면서 보름 가까이 진통을 겪었는데, 최고위원은 의원총회에서 ""선당 후사하겠다""고 밝혔다."
"“황보승희 동거남, 의원실 비서를 기사로 부렸다”","황보승희 국민의힘 의원/뉴스1
국민의힘 황보승희 의원과 동거 중인 부동산 사업자 A씨가 황보 의원의 묵인 아래 의원실 관용차와 보좌진, 사무실 경비 등을 사적으로 이용했다는 의혹이 14일 제기됐다. 정치권에서는 “국민 세금으로 지원되는 국회의원의 공적 권한을 공사 구분 없이 남용했다”는 지적이 나온다. A씨는 황보 의원에게 신용카드와 현금, 아파트 등을 제공해 정치자금법을 위반한 혐의로 현재 황보 의원과 함께 경찰 수사를 받고 있다. 혼인 신고를 하지 않은 두 사람은 사실혼 관계를 주장하는 반면, 황보 의원 전 남편은 불륜 문제를 당에 제기해 왔다.
본지 취재를 종합하면, 2020년 4월 황보 의원이 총선에서 당선된 이후 A씨는 황보 의원과 함께 관용차를 타고 의원회관 사무실을 드나든 것으로 알려졌다. 이렇게 하면 민간인 신분인 A씨가 출입 기록을 남기지 않고도 회관에 들어올 수 있다. 대신 A씨는 출입증이 있는 의원실 보좌진을 대동해 여권 실세 및 핵심 당직 의원 사무실 등을 오갔다고 한다. A씨가 황보 의원실을 마치 개인 사무실처럼 이용했다는 것이다. 더불어민주당 부산 지역위원장 출신 A씨는 2021년 국민의힘 입당 후 내년 총선 출마를 검토하는 것으로 알려졌다.
또한 A씨는 사업체가 있는 부산과 서울을 오갈 때마다 국회 사무처에서 지원되는 의원실 운영비로 KTX를 이용했다는 의혹도 제기됐다. 황보 의원이 “회장님을 모셔줘라”고 지시한 것으로 알려졌다. A씨는 공항과 기차역 등은 물론 주말 개인적인 용도로도 의원실 관용차와 수행비서를 개인 운전사처럼 부렸다는 주장도 나왔다.
지난달까지도 A씨는 의원실 수행비서가 운전하는 관용차를 타고 개인 행사에 참석한 것으로 확인됐다. 의원실 보좌진이 A씨의 사진을 찍어주기 위해 개인 비서처럼 동행까지 한 것으로 나타났다. A씨의 개인 해외 업무를 위해 의원실 보좌진이 수행하며 통역을 해준 사실도 드러났다.
A씨는 황보 의원을 앞세워 여권 실세로 꼽히는 B의원을 비롯해 국민의힘 현역 의원들과도 친분을 쌓은 것으로 알려졌다. 일각에서는 A씨가 이러한 의원들과의 술자리에서 비용을 대신 지불했다는 의혹도 나왔다. 경찰 역시 황보 의원이 A씨로부터 받은 신용카드를 국민의힘 의원들과의 식사 자리 등에서 사용한 혐의에 대해 수사 중으로 알려졌다. 일부 국민의힘 의원은 “A씨가 의원회관과 국회 안팎에서 황보 의원과 함께 다니는 것을 자주 봤다”고 했다.
A씨는 본지 통화에서 의혹을 전면 부인했다. A씨는 “나는 택시와 지하철을 타고 다닌다. 집에 있다가 노선이 같을 경우 황보 의원과 함께 관용차를 타긴 했지만 혼자 탄 적은 없다”며 “KTX를 의원실 공금으로 이용한 적도 결코 없다”고 했다. 그는 “B의원과는 개인적으로 친해 간혹 술을 마신 것은 맞지만 술값을 계산한 적은 없다”면서도 “황보 의원과 사실혼 관계에서 주고받은 게 정치자금과 무슨 상관이 있느냐”고 했다.
황보 의원과 2021년 이혼한 전 남편은 “2020년 총선 전부터 두 사람이 불륜 관계였다”며 문제를 제기해왔다. 현재 A씨는 부인과 이혼을 하지 않은 상태다. 이런 문제로 2021년 6월 황보 의원은 이준석 대표 체제에서 수석 대변인에 임명됐지만 두 달 만에 사퇴했다. 이후 국민의힘은 황보 의원에 대해 아무 조치를 취하지 않다가 13일에서야 징계를 위한 당무감사를 결정했다. 황보 의원은 의혹과 관련, 본지에 “경찰에서 충분히 소명했다”며 “당무 감사 조사에 성실히 임할 예정”이라고 했다.",https://www.chosun.com/politics/assembly/2023/06/15/CSGYAIGBTZBTDCT7FRPZKPOXFU/,2023-06-15,"국민의힘 의원 황보승희와 동거 중인 A씨가 의원실 관용차와 보좌진, 사무실 경비 등을 사적으로 이용한 의혹이 제기됐다. A씨는 황보 의원에게 신용카드와 현금, 아파트를 제공해 정치자금법을 위반한 혐의로 경찰 수사를 받고 있다. A씨는 의원실 운영비로 KTX를 이용하고 관용차와 수행비서를 개인 운전사처럼 부르며 의원실 보좌진이 개인 업무를 수행하게 했다. A씨는 국민의힘 현역 의원들과 친분을 쌓고 술자리에서 비용을 대신 지불한 의혹도 있다."
