제목,본문,URL,날짜,요약
"의료분쟁 ‘조정’ 위해 도입한 환자 대변인, 오히려 소송 ‘조장’?","정부가 의료분야 경험이 있는 변호사 50명을 환자 대변인으로 위촉해 의료사고분쟁에 나선 환자와 보호자를 지원하기로 했다. 의료계 내에서 의료분쟁 조정 활성화가 아니라 소송이 늘어날 것이란 우려가 나온다(사진출처: 게티이미지). 의료분쟁조정제도 활성화를 위해 도입되는 ‘환자 대변인’제도가 오히려 소송을 조장할 수 있다는 지적이 제기됐다. 정부 위촉을 받은 변호사 출신 환자 대변인들이 의료사고로 억울함을 호소하는 환자와 보호자들 앞에서 객관적으로 의료계 편을 들어주기 어렵고, 이 과정에서 조정사건이 소송으로 이어질 가능성이 높다는 것이다. 보건복지부는 지난 14일 환자 대변인제도 도입계획을 공개했다. 환자 대변인은 사망, 1개월 이상 의식불명 등의 중대한 의료사고 피해를 입은 당사자가 분쟁 조정을 희망하는 경우 감정과 조정 전 단계에 걸쳐 전문적 조력을 제공한다. 환자 대변인은 의료사고 분야에 전문성과 경험을 가진 변호사 중 50인 내외를 선발해 운영하며, 정부는 이들이 환자들을 대상으로 법률 상담과 자문을 하고 자료 제출 및 쟁점 검토 등을 도와 의료인과 환자 모두가 만족하는 조정에 이르도록 지원한다는 방침이다. 하지만 정부 위촉 변호사들이 의료사고 분쟁 조정 과정에서 환자를 지원하는 것에 대해 의료계 내 우려가 크다. 수도권 한 중소병원 원장은 청년의사와 통화에서 “정부는 환자 대변인제도를 통해 분쟁 조정을 활성화하겠다고 하지만 정부 위촉 변호사들이 의료사고로 억울함을 호소하는 환자들에게 ‘결과는 좋지 않지만 의학적으로 의사가 잘못한 것은 없어 보인다’는 말을 할 수는 없을 것”이라고 말했다. 이어 “환자 변호사는 어떤 의미에서 국선변호사와 비슷한데, 화가 많이 난 환자와 보호자들 앞에서 ‘의사도 어쩔 수 없었다. 의사도 최선을 다했다’는 말 보다는 ‘뭐가 궁금하냐. 이런 자료를 요청할 수 있다’ 등의 말을 하게 될 것”이라며 “목적은 어떨지 모르지만 분쟁에서 선한 중재자가 되기 보다는 (소송) 가이드를 해주는 변호사가 될 가능성이 높다”고 강조했다. 실제 한국의료분쟁조정중재원이 홈페이지에 공개한 ‘의료분쟁 조정ㆍ중재 조력을 위한 환자 대변인 위촉계획 공고’를 보면 환자 대변인은 지원 신청자에 ▲조정 및 중재 관련 법률 자문 및 상담 ▲당사자가 제출한 조정 신청서ㆍ자료에 대한 검토 및 보완 ▲분쟁 쟁점 검토, 감정서 및 조정서 등에 대한 의견 ▲감정ㆍ조정 과정에서 법적 조력이 필요한 사안 등을 지원한다. 그는 “변호사 출신 환자 대변인을 통해 조정과 중재를 지원하는 것이 최선의 선택인지 모르겠다. 분쟁 상황에 따른 객관이고 의학적인 조력은 변호사가 할 수 있는 영역이 아니다”라며 “의사는 의사편을 들 것이라고 생각하지만 객관적으로 의료감정을 해주는 의사들도 많다. 차라리 익명으로 객관적 의료감정을 해주는 의사 풀을 넓혀 환자와 보호자를 지원하는 방안이 낫다”고 주장했다. 이어 “변호사를 통한 환자 대변인제도는 의료분쟁 조정과 중재를 활성화한다는 취지지만 결국 소송을 조장할 가능성이 높다”며 “취지는 이해하지만 안타깝다”고 덧붙였다. 또 다른 의료계 한 관계자 역시 변호사를 통한 환자 대변인 제도는 분쟁 조정이나 중재를 소송으로 키울 가능성이 높다고 지적했다. 그는 “제도를 보면 결국 정부가 의료분야 경험이 있는 변호사를 모으고 예산을 투입해 분쟁 조정과 중재에 나선 환자들에 변호사를 매칭해주는 것”이라며 “사실상 의료분야 국선변호사라고 보면 될 것”이라고 말했다. 이어 “변호사 특성상 환자나 보호자를 대상으로 법률 중심 자문을 할 것인데, 결국 지원받은 환자나 보호자들이 분쟁 조정이나 중재보다 소송을 선택할 가능성이 더 높아보인다”고 덧붙였다. 한편 복지부는 의료계 이같은 우려에 대해 환자 대변인은 분쟁 조정이나 중재 과정에서 절차조력만 할 수 있기 때문에 문제가 없다는 입장이다. 복지부 관계자는 청년의사와 통화에서 “일반 변호사와 환자 대변인은 같은 변호사지만 다르다. 환자 변호사는 일반 변호사처럼 환자와 보호자 이익을 위해 활동하지 않는다”며 “분쟁 조정이나 중재 과정에서 절차에 어려움을 겪는 분들을 돕기 위한 것”이라고 말했다. 이어 “지방노동위원회에도 절차 조력 변호사들이 있는데, 이와 같다고 보면 된다”며 “일각에서 환자 대변인을 매칭해주면 이들이 소위 ‘영업’을 할 것이란 우려를 하는데, 환자 대변인은 변호사로서 영업활동을 하지 못하고 순수하게 절차 조력만 하도록 업무범위를 정할 것”이라고 강조했다. 그러면서 “제도를 운영하다보면 예상치 못한 문제가 발생할 수 있고 불분명한 부분도 있을 수 있다. 그래서 (5월부터 시작하는 제도는) 시범사업 형태로 운영하며 모니터링할 것”이라며 “의료계에서는 의료인도 (환자나 보호자와) 마찬가지로 법적 부분 지원이 필요하다는 의견도 있어 이 부분도 제도 시행 과정에서 들여다볼 것”이라고 덧붙였다.",http://www.docdocdoc.co.kr/news/articleView.html?idxno=3027666,2025-04-15,"정부가 의료분야 경험이 있는 변호사 50명을 환자 대변인으로 위촉하여 의료사고분쟁에 대응하기로 했다. 그러나 의료계 내에서는 이러한 대변인제도가 소송을 촉진할 우려가 있다. 일부 의사들은 변호사 출신의 대변인이 환자를 객관적으로 지원하기 어렵다며, 소송을 유발할 수 있다고 우려했다. 한편 보건복지부는 이 대변인들이 의료사고 피해자에게 법률상담과 조력을 제공하여 분쟁을 조정하는 것을 목표로 한다고 밝혔다."
의료사고 합의했는데…건보공단이 '구상권'까지 청구 결과는?,"건보공단, 의료사고 피해 환자 진료비 2882만원 의원 대상 소송 대법원 ""본인부담금상한제 환급금도 구상권 대상"" 파기환송 ⓒ의협신문 의료사고로 환자에게 악결과가 생겼을 때 발생한 진료비 중 급여비는 건강보험공단의 구상권 대상이다. 여기에다 대법원은 최근 본인부담금상한제에 따라 환자에게 돌려준 환급금도 구상권 행사 대상에 들어간다는 취지의 판단을 내렸다. 의료사고에 대해 환자 측에 합의금을 제시하고 민형사상 소송을 제기하지 않겠다는 합의까지 했더라도 건강보험 급여 영역에서 의료기관이 받아 간 비용을 돌려받기 위한 건보공단의 작업은 별개의 영역이었다. 대법원 제3부(재판장 이흥구)는 3일 건보공단이 인천 L원장과 해당 의원에서 일했던 간호조무사를 상대로 제기한 구상금 소송에서 원고일부승소 판결을 내린 원심을 파기하고, 사건을 수원지방법원으로 돌려보냈다. L원장과 간호조무사 두 명은 60대 여성 환자 두 명에게 오염된 수액제제를 주사하는 의료사고를 일으켰다. 해당 사고로 환자 한 명은 사망했고, 다른 한 명은 약 17일간 치료가 필요한 패혈성 쇼크가 왔다. 의료사고의 구체적 내용은 이렇다. L원장은 정맥으로 투여하는 수액제제인 일명 '마늘주사'를 처방했다. 해당 주사는 토비다솔 수액(250ml)에 네오미노화겐씨 앰플(10ml), 미앤타민 앰플(10ml) 및 파인하이민 앰플(10ml)를 혼합해 정맥으로 투여한다. 토비다솔 수액에 앰플들을 혼합하기 위해서는 수액의 일정량을 덜어내 약 30ml 이상의 여유 공간을 만들어야 하는데 수액병에서 주사기로 일정량의 수액을 덜어내는 작업을 해야 한다. L원장은 투약 직전에 마늘주사 제제를 만들면 시간이 오래 걸린다는 이유로 간호조무사에게 진료 전날에 다음날 수요를 예측해 토비다솔 수액병에서 수액 일정량을 덜어내 미리 준비해둘 것을 지시했다. 간호조무사는 토요일 오후에 월요일 진료 수요를 예측해 토비다솔 수액병 2개의 보호캡을 제거한 후 고무입구에 10cc 주사기를 수회 찔러 각 약 50ml씩 뽑아낸 다음 수액병을 실온 상태의 처치실 선반에 그대로 올려뒀다가 월요일에 환자 두 명에게 사용했다. 정맥주사 15~30분 후 환자들은 구역, 구토, 어지러움, 오한, 가슴 답답함 및 통증을 호소하고 말이 어눌해지고 몸을 제대로 가누지 못하는 등의 이상 증상을 보였다. L원장과 간호조무사 2명은 업무상 과실치사, 업무상 과실치상으로 각각 금고 1년 6개월과 금고 6개월에 집행유예 2년형을 받았다. L원장은 해당 의료사고로 사망한 환자 유족에게 5000만원을 지급했으며, 유족은 민·형사상 이의를 제기하지 않기로 합의했다. 형사 판결은 건보공단의 구상권 청구로 이어졌다. 형사 처벌도 받았고, 의료사고를 당한 환자 측과 합의도 했지만 건보공단은 환자 두 명에게 들어간 치료비를 의료사고를 당한 환자의 '손해'라고 보고 손해배상 청구에 나선 것. 국민건강보험법 제58조에 따르면 건보공단은 제3자의 행위로 보험급여 사유가 생겨 가입자나 피부양자에게 보험급여 했을 때 급여 비용 한도에서 제3자에게 손해배상을 청구할 권리가 있다. 1심을 진행한 수원지방법원은 두 명의 환자 치료에 들어간 진료비 2882만원을 L원장과 간호조무사 2명이 나눠서 내라고 판단했다. 다만 사망한 환자가 낸 본인부담상한액 초과로 건보공단이 환급한 107만8770원에서 구상권은 발생하지 않는다고 했다. 의료사고와 관련성을 인정하기 부족하다는 이유에서다. 환자와 합의한 내용도 소용없었다. 재판부는 ""환자에게 손해배상금 지급 이전에 건보공단이 급여를 해 급여 한도 안에서 L원장 등에 대한 구상권을 취득했다""라며 ""L원장이 손해배상금 명목의 돈을 지급했다고 해서 건보공단의 구상권에 영향이 있다고 할 수 없다""고 선을 그었다. 대법원은 이마저도 판단을 달리했다. 본인부담상한액 초과 금액 사후환급금에 대해서도 손해배상을 청구할 수 있다고 보고 사건을 파기환송했다. 대법원은 ""본인부담금 연간 총액이 대통령령으로 정하는 금액을 넘어서면 그 초과금액을 건보공단이 부담토록 규정하고 있다""라며 ""본인부담상한액 초과 금액은 요양급여비용 중 건보공단 부당금에 해당한다""고 설명했다. ""건보공단이 가입자 등에게 초과 금액을 지급하는 것은 요양급여비용의 사후 정산으로 볼 수 있고 제3자의 행위로 보험급여 사유가 생겨 건보공단이 본인부담상한액 초과 금액을 지급하는 결과가 발생했다면 초과 금액 한도 안에서 제3자에게 손해배상을 청구할 수 있다""고 밝혔다. 저작권자 ? 의협신문 무단전재 및 재배포 금지",https://www.doctorsnews.co.kr/news/articleView.html?idxno=159042,2025-04-09,"건강보험공단이 의료사고로 인한 진료비 2882만원을 의료진에게 구상권 청구했던 소송에서 대법원은 본인부담금상한제에 따른 환급금도 구상권 대상이라는 판결을 내렸다. 환자에게 합의금을 제공하고 소송을 회피했다 해도 건강보험 급여비용은 별개로 취급되며, 형사 처벌과 합의금 지급에도 불구하고 건보공단이 환자들의 치료비를 손해배상 청구한 것이다. 대법원은 환자의 본인부담금 초과 금액에 대한 손해배상 청구도 가능하다고 판단했다."
의료분쟁 조정 돕는 변호사 ‘환자 대변인’ 내달 도입｜동아일보,"크게보기 지난달 5일 오전 서울 종로구 경제정의실천시민연합 강당에서 열린 의료사고 안전망 강화를 위한 시민사회 입장 발표 기자간담회에서 참석자들이 피켓을 들고 기념촬영을 하고 있다. 한국환자단체연합회와 경실련 등 참가 단체들은 이 자리에서 의료사고 안전망 구축을 위해 의료사고 입증책임 전환, 의료 감정의 공정성 제고, 의료사고의 공적 배상책임 강화 및 불합리한 수사절차 개선 등을 촉구했다. 뉴스1 정부가 의료사고 분쟁 조정 때 환자를 지원하는 ‘환자 대변인’ 제도를 도입한다.14일 보건복지부는 환자 대변인으로 활동할 변호사 50여 명을 30일까지 모집한다고 밝혔다. 복지부는 올해 국비 3억 원을 투입해 경력 3년 이상 변호사 중 의료 분야 전문성을 갖춘 이들을 환자 대변인으로 선발할 예정이다.선발된 환자 대변인은 한국의료분쟁조정중재원(중재원)을 통해 의료사고 분쟁 조정을 신청한 환자를 법적으로 돕게 된다. 1개월 이상 의식불명, 사망 등 중대한 의료사고 피해를 입은 당사자가 분쟁 조정을 희망하는 경우 조정신청서나 의견서 작성 등에 도움을 주거나 법률 상담과 자문을 제공하는 형태다.본격적인 서비스 제공은 5월부터 시작된다. 김국일 복지부 보건의료정책관은 “환자대변인을 시작으로 의료분쟁 조정 전반을 혁신해 조정은 활성화하고 소모적 소송은 최소화할 수 있도록 최선을 다하겠다”고 밝혔다.",https://www.donga.com/news/Society/article/all/20250414/131409752/1,2025-04-14,"한국환자단체연합회와 경실련은 의료사고 안전망을 강화하기 위해 의료사고 입증책임 전환, 의료 감정의 공정성 제고, 의료사고의 공적 배상책임 강화를 요구했다. 보건복지부는 올해 국비 3억 원을 투입하여 환자 대변인으로 활동할 변호사 50여 명을 모집할 예정이며, 이들은 중대한 의료사고 피해를 입은 환자들을 법적으로 돕게 된다. 본격적인 서비스 제공은 5월부터 시작되며, 김국일 복지부 보건의료정책관은 의료분쟁 조정을 혁신하여 소모적 소송을 최소화할 계획이라고 밝혔다."
"복지부, '의료분쟁 조정 환자대변인' 모집…30日까지","보건복지부가 오는 30일까지 의료분쟁 조정 환자대변인으로 활동할 전문가를 모집한다고 14일 밝혔다. 환자대변인은 의료사고로 인한 분쟁 조정시, 환자를 법적·의학적으로 조력하는 역할을 맡는다. 복지부가 지난달 발표한 의료개혁 2차 실행방안 '의료사고 안전망 구축' 주요 과제로, 의료분쟁 조정 신뢰도를 높이고 분쟁 해결 활성화로 환자와 의료인 모두를 보호하기 위해 마련했다. 소송에 의존하는 기존 해결 방식은 환자와 의료인 모두에게 부담으로 작용했다. 환자대변인은 사망, 1개월 이상 의식불명 등 중대한 의료사고 피해를 입은 당사자가 분쟁 조정을 희망하는 경우, 감정과 조정 전 단계에 걸쳐 전문적 조력을 제공하게 된다. 법률 상담과 자문, 자료제출, 쟁점 검토 등을 도와 조정 도달을 돕는다. 환자대변인은 의료사고 분야에 전문성과 경험을 가진 변호사 중 50인 안팎을 선발한다. 자격요건 확인 등을 거쳐 위촉하며, 대변인 활동 전 일정 시간의 교육 프로그램을 이수해야 한다. 환자대변인 참여를 희망하는 경우 이달 30일 오후 6시까지 한국의료분쟁조정중재원으로 신청서·증빙서류 등을 제출하면 된다. 정부는 환자대변인 위촉과 교육을 마친 5월부터 조력 서비스를 제공한다. 사업 초기 환자대변인 운영 점검 자문단을 구성해 지원현황과 만족도 등을 주기적으로 점검할 계획이다. 김국일 복지부 보건의료정책관은“환자대변인을 시작으로 의료분쟁 조정 전반을 혁신해 조정은 활성화하고 소모적 소송은 최소화하겠다”면서 “더불어 불가항력 사고에 대한 국가보상 강화, 공적 배상체계 구축, 의료사고 특화 형사체계 마련 등 의료개혁 2차 실행방안을 차질없이 추진하겠다”고 말했다. 송윤섭 기자 sys@etnews.com",https://www.etnews.com/20250414000071,2025-04-14,"보건복지부가 의료분쟁 조정을 위해 환자대변인을 모집한다. 환자대변인은 의료사고로 인한 분쟁 시 환자를 법적·의학적으로 돕는 역할을 맡는다. 이는 의료분쟁 조정의 신뢰도를 높이고 분쟁을 해결하여 환자와 의료인을 보호하기 위한 조치로, 환자와 의료인 양측에 부담을 덜어줄 것으로 기대된다.환자대변인은 의료사고 분야에 전문성과 경험을 가진 변호사 중 50인을 선발하며, 5월부터 조력 서비스를 제공할 예정이다. 국가보상 강화와 의료사고 특화 형사체계 마련 등을 통해 의료개혁을 지속적으로 추진할 방침이다."
의료분쟁 해결해 줄 '환자대변인' 나온다,"▲ 보건복지부는 의료분쟁 소송을 최소화하기 위해 의료분쟁 조정 환자대변인 사업을 추진한다. ⓒ 세이프타임즈 보건복지부는 의료분쟁 조정 환자대변인 사업에 참여할 환자대변인 전문가를 모집한다고 14일 밝혔다. 사업은 의료사고 분쟁 환자에게 법률적·의학적 도움을 줄 수 있는 대변인 서비스를 제공한다. 의료사고 분쟁을 소송보다 조정을 통해 해결하려는 취지다. 복지부 관계자는 ""의료사고 발생 시 소송에 의존하는 해결방식은 환자·의료진 양측에 큰 부담""이라며 ""의료분쟁 조정제도를 운영하고 있지만 전문성·정보가 부족한 환자 입장에서는 소송을 더 선호한다""고 말했다. 환자대변인은 중대의료사고 피해 당사자가 분쟁 조정을 희망할 때 감정·조정 등 모든 단계에 전문조력을 제공한다. 법률상담·자문·자료제출·쟁점검토 등을 도와 조정에 이르도록 지원한다. 복지부는 의료사고 전문 변호사 50여명을 선발해 사업을 운영한다. 환자대변인은 신청서류에 기반해 자격요건 확인 등을 거쳐 선발하고 오는 5월부터 서비스 제공에 나선다. 김국일 보건의료정책관은 ""의료분쟁 조정 전반을 혁신해 소모적 소송을 최소화하도록 최선을 다하겠다""며 ""환자와 의료인 모두를 위한 의료사고 안전망을 마련하겠다""고 말했다. 참여 희망자는 30일까지 의료분쟁조정중재원에 신청서·증빙서류를 제출해야 한다. 참여자는 활동에 앞서 일정 시간 교육 프로그램을 이수해야 한다.",https://www.safetimes.co.kr/news/articleView.html?idxno=228397,2025-04-14,"보건복지부는 의료분쟁 소송을 최소화하기 위해 의료분쟁 조정 환자대변인 사업을 추진합니다. 이 사업은 의료사고 분쟁 환자에게 법률적·의학적 도움을 제공하고, 의료분쟁을 소송보다 조정을 통해 해결하는 것을 목표로 합니다. 의료사고 전문 변호사 50여명을 선발해 환자대변인으로 활동하며, 참여 희망자는 30일까지 신청서와 증빙서류를 제출하고 교육 프로그램을 이수해야 합니다. 이를 통해 의료분쟁 조정제도를 혁신하여 소송을 최소화하고 환자와 의료진 모두에게 안전한 의료사고 대응망을 제공할 계획입니다."
"복지부, 의료사고 보상하는 보험사 직접 설립하나?","정책보험 상품 만들 계획…""구체적 논의는 아직"" 복지부 내 의료사고심의위원회 신설 및 권한 확대 예고 ⓒ의협신문 정부가 의사의 사법리스크 완화를 논의하며, 직접 보험사를 만들어 의료사고 책임보험 상품을 제공하는 방법도 고민하는 것으로 드러났다. 보건복지부 의료개혁특별위원회 산하 의료사고안전망전문위원회는 지난해 9월 의료사고 안전망 구축방안으로 ▲의료사고 소통지원법 제정 ▲환자대변인제 도입 등 분쟁조정제도 개선 ▲의료사고 배상보험·공제 확충 ▲의사 수사부담 완화 및 형사특례 법제화 등을 제시한 바 있다. 강준 보건복지부 의료개혁추진단 의료개혁총괄과장은 최근 전문기자협의회와 만나 의료사고안전망 관련 정부의 입장과 함께 의료사고 책임보험 가입에 대한 논의 내용을 설명했다. 책임보험 가입과 관련해 의료사고 형사 특례의 전제조건이 아닌 기본사항이라는 점을 강조한 강준 과장은 자동차 보험을 예로 들며 ""자동차 보험 같은 경우도 전체 의무 가입돼 있으니까 금융이라든가 국토부에서 보험 상품 규제를 하고 있다""며 ""교통사고든 의료사고든 사회적인 문제가 있기 때문에 가입을 의무화하는 정부 주도의 정책보험이 필요하다""고 밝혔다. 그러면서 ""필수의료 쪽 분야에 대해서는 특별 배상하는 상품, 한도가 높은 특별 보상 상품을 만들 계획""이라며 ""정부 주도의 정책 보험을 만들어 민간보험사나 공제조합에서 상품을 팔수 있도록 유도하거나 정부가 직접 보험사를 지어서 상품을 제공하는 방법도 고민하고 있다""고 덧붙였다. 강준 과장은 ""책임보험 가입에 대해 추가적인 논의가 더 필요하다. 현재 국회에서 논의 중인 의료사고분쟁법이 통과된다면 본격적으로 논의될 것""이라고 전망하며 ""연내에 법안이 통과됐으면 좋겠다""고 전했다. 의사의 사법리스크 완화를 위해 의료사고를 심의하는 위원회의 권한을 확대하고 의료사고를 감정하는 시스템을 개선하는데 방점을 두고 진행하는 것으로 나타났다. 앞서 보건복지부는 6일 의료사고에서 중대한 과실 판단은 정부 내 법정 상설 심의기구로 신설될 의료사고심의위원회가 맡는다고 발표했는데, 해당 위원회에 힘을 싣는 모양새다. 강준 과장은 ""마음에 안들면 소송하고 이런게 아니라 위원회에 어느정도 권위를 부여하면 지금 감정도 이전보다 더 강화할 수 있다""며 ""감정도 의료인 감정의 경우 지금보다 인원을 늘리고, 분쟁조정제도에서 환자 대변인 등이 참여할 수 있게 해준다면 감정이 개선되고 상호 보완적으로 좋아질 것이라 기대한다""고 밝혔다. 의료사고심의위원회 기구 설립의 필요성에 대해서도 의료계의 공감된 입장을 얻었다고도 했다. 강 과장은 ""(의료사고에 대한)수사가 본격적으로 들어가기 전에 의도적인지, 수사 기소단계로 본격적으로 가야할지 이런 거를 사전에 결정하고 논의할 수 있는 구조가 있다면 수사기간이 단축될 것이라는 의료계 입장도 있었다""며 ""형사 당국에서도 권위를 갖고 신뢰할 수 있는 기구에서 결정을 내린다고 하면 그 결정을 존중하는 구조로 가지 않을까 생각한다""고 언급했다. 의료사고심의위원회는 보건복지부 내에 구성하고 관계기관, 부처가 참여하는 형태로 운영될 가능성이 높다. 아울러, 위원회가 형사체계의 일부가 될 수 없는 만큼 위원회 운영과정에서 수사 당국하고 연계 체계를 마련한다는 방침이다. 이밖에 의료사고 소통 강화법, 이른바 의사 사과법 도입 계획과 관련해서는 '시범사업 형태'로 운영할 계획이다. 강 과장은 ""법이 도입되더라도 새로운 방식이니까 현장에서의 유의미한 변화가 있는지 볼 예정""이라며 ""기본적으로 의료사고가 발생했을 때 신뢰 관계를 만들어주는 것이 제일 중요하다""고 말했다. 저작권자 ? 의협신문 무단전재 및 재배포 금지",https://www.doctorsnews.co.kr/news/articleView.html?idxno=158719,2025-03-18,"정부는 의료사고 책임보험 상품을 제공하는 방안을 논의 중이며, 의료사고안전망전문위원회는 의료사고 소통지원법 제정과 의료사고 배상보험 확충 등을 제시했다. 보건복지부는 의료사고심의위원회를 신설하고 권한을 확대하여 의료사고 감정 시스템을 개선하고자 하며, 의료계에서는 위원회의 설립이 필요하다는 공감이 있다고 전해졌다. 또한, 의료사고 소통 강화법과 의사 사과법 도입 계획도 '시범사업 형태'로 운영할 예정이다."
